user_input,retrieved_contexts,response,reference,faithfulness,context_precision,context_recall,answer_relevancy,answer_correctness
"2024년 4/4분기 기준, 자동차 부문에서 수출(대수기준)의 전년동기대비 증감률은 얼마인가?","['[Document 1]\nMetadata: {\'producer\': \'Hancom PDF 1.3.0.538\', \'modDate\': ""D:20250217103412+09\'00\'"", \'page\': 10, \'keywords\': \'\', \'source\': \'2024_4사분기_주력산업_모니터링_보고서.pdf\', \'author\': \'2010127\', \'page_count\': 39, \'year\': 2024, \'trapped\': \'\', \'quarter\': 4, \'format\': \'PDF 1.4\', \'file_path\': \'/workspaces/codespaces-jupyter/llmops_class/data/bok_major_industry_reports/2024_4사분기_주력산업_모니터링_보고서.pdf\', \'has_images\': False, \'title\': \'\', \'creator\': \'Hwp 2018 10.0.0.10640\', \'subject\': \'\', \'creationDate\': ""D:20250217103412+09\'00\'""}\nContent: 2024년 4/4분기 주력산업 모니터링 보고서(Ⅱ. 자동차)\n\n\n\n\n###### 최근 동향\n\n**1. 2024년 4/4분기 중 국내 자동차 생산(대수)은 파업, 폭설 등으로 인한 생산 및 부품**\n\n\n**공급 차질** **[25)]** **에도 불구하고 수출이 소폭 증가로 전환** **[26)]** **(+0.4%)하고 국산차 내수판매 부**\n\n\n**진이 완화** **[27)]** **되면서 전년동기대비 소폭 증가(+0.6%)하였다.**\n\n\n자동차 생산대수 소폭 증가 가동률지수도 장기평균 소폭 상회 자동차 생산지수는 소폭 감소\n\n\n[그림 2.1] 자동차 생산대수 [1)] [그림 2.2] 자동차산업 가동률지수 [1)] [그림 2.3] 자동차산업 생산지수 [1)]\n\n\n\n40\n\n\n\n(p)\n\n\n\n60\n\n\n45\n\n\n\n19.1/4 20.1/4 21.1/4 22.1/4 23.1/4 24.1/4\n\n\n\n(2020=100) (전년동기대비, %)\n\n\n\n**129.4**\n\n\n20\n\n\n0\n\n\n-20\n\n\n-40\n\n\n\n250\n\n\n200\n\n\n150\n\n\n100\n\n\n50\n\n\n0\n\n\n\n19.1/4 20.1/4 21.1/4 22.1/4 23.1/4 24.1/4\n\n\n\n(만대) (만대)\n\n\n\n100\n\n\n50\n\n\n0\n\n\n\n(2020=100)\n\n\n\n15\n\n\n0\n\n\n-15\n\n\n-30\n\n\n\n150\n\n\n120\n\n\n90\n\n\n60\n\n\n30\n\n\n\n250\n\n\n\n140\n\n\n120\n\n\n100\n\n\n80\n\n\n60\n\n\n\n**90**\n\n\n\n200\n\n\n150\n\n\n\n주: 1) 해외생산은 현지법인에 대한\n\n지분율이 50% 이상이거나\n경영권을 행사하는 경우\n자료: 한국자동차모빌리티산업협회\n\n\n\n19.1/4 20.1/4 21.1/4 22.1/4 23.1/4 24.1/4\n\n\n주: 1) 자동차부품 포함\n2) 최근 10년 평균\n\n(2015.1/4분기~2024.4/4분기)\n자료: 통계청\n\n\n\n주: 1) 자동차부품 포함\n자료: 통계청\n\n\n\n25) 자동차 부품업체 동희산업 화재(10월), 현대 트랜시스 파업(10~11월), 폭설로 인한 기아차 화성공장 가동 중단\n\n(11.28~12.3일), 부품사 납품지연, 금속노조 파업(12월) 등\n26) 자동차 수출대수 증가율(%, 전년동기대비): 2024년 1/4분기 +0.6 → 2/4 +5.7 → 3/4 –5.1 → 4/4 +0.4\n27) 국산차 내수판매(%, 전년동기대비): 2024년 1/4분기 –11.7 → 2/4 -12.4 → 3/4 –4.0 → 4/4 -0.7 <24년 -7.4>\n28) 경기 부진에 따른 구매심리 위축 및 인기차종(경유모델) 단종으로 연중 내수판매가 부진하였으며, 하반기 중 상용차 수출도\n\n감소하면서 생산이 감소하였다. 상용차 생산 증가율(전년동기대비)은 2024년 1/4분기 –2.3%, 2/4분기 –14.2%, 3/4분기 –20.1%,\n4/4분기 –30.7%를 기록하였다.\n\n\n                       - 6\n\n[Document 2]\nMetadata: {\'modDate\': ""D:20250217103412+09\'00\'"", \'has_images\': False, \'year\': 2024, \'author\': \'2010127\', \'producer\': \'Hancom PDF 1.3.0.538\', \'source\': \'2024_4사분기_주력산업_모니터링_보고서.pdf\', \'creator\': \'Hwp 2018 10.0.0.10640\', \'page_count\': 39, \'quarter\': 4, \'keywords\': \'\', \'page\': 13, \'creationDate\': ""D:20250217103412+09\'00\'"", \'file_path\': \'/workspaces/codespaces-jupyter/llmops_class/data/bok_major_industry_reports/2024_4사분기_주력산업_모니터링_보고서.pdf\', \'title\': \'\', \'trapped\': \'\', \'format\': \'PDF 1.4\', \'subject\': \'\'}\nContent: 2024년 4/4분기 주력산업 모니터링 보고서(Ⅱ. 자동차)\n\n\n**5. 자동차 수출은 하이브리드차를 중심으로 북미 수요가 지속되겠으나, 유럽 판매 부진,**\n\n\n**미국의 관세정책에 대응한 현지생산 확대 등으로 감소할 것으로 예상된다.**\n\n\n**6. 국내 자동차 생산은 완만한 내수판매 회복세에도 불구하고 수출이 부진한 모습을 보이**\n\n\n**면서 전체적으로는 감소할 것으로 예상된다.**\n\n\n연간 자동차 생산 및 내수판매 전망 하향 미국의 보호무역주의 정책 강화\n\n\n[그림 2.7] 2025년 국내 자동차 생산·내수판매 전망 [1)] [표 2.1] 미 트럼프 정부의 주요 통상·산업정책\n\n\n\n0\n\n\n-2\n\n\n-4\n\n\n-6\n\n\n\n2\n\n\n0\n\n\n-2\n\n\n\n(%) (%)\n\n\n\n생산 내수\n\n\n\n|구 분|내 용|\n|---|---|\n|자국산업<br>보호<br>전기차<br>정책|·캐나다·멕시코 관세 25%<br>부과(2.4일부터 30일간 유예 중)<br>·중국 관세 10% 추가 부과(2.4일)<br>·보편관세 부과 및 기존 무역협정<br>재협상 검토<br>·전기차 의무화 목표(2030년까지 신차<br>판매의 50%) 폐지<br>·전기차 충전 인프라 구축 기금 집행<br>중단(50억달러)<br>·IRA 보조금 혜택 축소·폐지 검토|\n\n\n자료: 언론사 등\n\n\n\n\n\n\n\n\n\n\n\n\n\n\n\n주: 1) 전년동기대비 증감률\n자료: S&P Global Mobility\n\n\n\n43) 하이브리드차는 북미시장에서 국내 완성차업체들의 경쟁사 대비 낮은 가격 및 옵션 경쟁력, 전기차 대체수요에 따\n\n른 판매 증가 등으로 양호한 판매실적을 이어갈 것으로 기대된다.\n44) 트럼프 대통령은 취임 당일(1.20일) 행정명령을 통해 미국의 무역적자 원인과 리스크를 조사하고 해소방안을 마련하\n\n여 4.1일까지 보고하도록 지시하였다. 트럼프 1기 정부에서는 2018년 한미 FTA 재협상을 통해 픽업트럭에 대한 관\n세 철폐(25%→0%) 기한을 기존 2021년에서 2041년까지 20년 연장한 바 있다.\n45) 현대차그룹은 미국 조지아주 전기차 전용공장(메타플랜트) 가동을 본격화(연간 30만대 생산 가능)하는 한편 미국 전\n\n기차 정책 변화에 대응하여 전기차와 하이브리드차를 혼류 생산할 계획이다.\n46) EU는 올해부터 완성차 제조사가 판매하는 신차의 평균 이산화탄소 배출 가능 상한선을 약 18% 낮추고, 기준초과\n\n시 1g당 95유로의 벌금을 부과한다고 밝혔다.\n47) 다만 주요 완성차업체들이 전기차 캐즘 극복을 위해 중저가 전기차 모델 판매(캐스퍼EV, EV3, EV6 F/L)를 이어가는\n\n가운데, EU의 중국산 전기차에 대한 관세인상(24.10월 말)등은 친환경차 판매에 긍정적 요인이다.\n\n\n                       - 9\n\n[Document 3]\nMetadata: {\'creationDate\': ""D:20250217103412+09\'00\'"", \'creator\': \'Hwp 2018 10.0.0.10640\', \'subject\': \'\', \'year\': 2024, \'source\': \'2024_4사분기_주력산업_모니터링_보고서.pdf\', \'producer\': \'Hancom PDF 1.3.0.538\', \'page_count\': 39, \'trapped\': \'\', \'keywords\': \'\', \'has_images\': False, \'quarter\': 4, \'file_path\': \'/workspaces/codespaces-jupyter/llmops_class/data/bok_major_industry_reports/2024_4사분기_주력산업_모니터링_보고서.pdf\', \'title\': \'\', \'format\': \'PDF 1.4\', \'modDate\': ""D:20250217103412+09\'00\'"", \'page\': 10, \'author\': \'2010127\'}\nContent: 2024년 4/4분기 주력산업 모니터링 보고서(Ⅱ. 자동차)\n\n\n\n\n###### 최근 동향\n\n**1. 2024년 4/4분기 중 국내 자동차 생산(대수)은 파업, 폭설 등으로 인한 생산 및 부품**\n\n\n**공급 차질** **[25)]** **에도 불구하고 수출이 소폭 증가로 전환** **[26)]** **(+0.4%)하고 국산차 내수판매 부**\n\n\n**진이 완화** **[27)]** **되면서 전년동기대비 소폭 증가(+0.6%)하였다.**\n\n\n자동차 생산대수 소폭 증가 가동률지수도 장기평균 소폭 상회 자동차 생산지수는 소폭 감소\n\n\n[그림 2.1] 자동차 생산대수 [1)] [그림 2.2] 자동차산업 가동률지수 [1)] [그림 2.3] 자동차산업 생산지수 [1)]\n\n\n\n40\n\n\n\n(p)\n\n\n\n60\n\n\n45\n\n\n\n19.1/4 20.1/4 21.1/4 22.1/4 23.1/4 24.1/4\n\n\n\n(2020=100) (전년동기대비, %)\n\n\n\n**129.4**\n\n\n20\n\n\n0\n\n\n-20\n\n\n-40\n\n\n\n250\n\n\n200\n\n\n150\n\n\n100\n\n\n50\n\n\n0\n\n\n\n19.1/4 20.1/4 21.1/4 22.1/4 23.1/4 24.1/4\n\n\n\n(만대) (만대)\n\n\n\n100\n\n\n50\n\n\n0\n\n\n\n(2020=100)\n\n\n\n15\n\n\n0\n\n\n-15\n\n\n-30\n\n\n\n150\n\n\n120\n\n\n90\n\n\n60\n\n\n30\n\n\n\n250\n\n\n\n140\n\n\n120\n\n\n100\n\n\n80\n\n\n60\n\n\n\n**90**\n\n\n\n200\n\n\n150\n\n\n\n주: 1) 해외생산은 현지법인에 대한\n\n지분율이 50% 이상이거나\n경영권을 행사하는 경우\n자료: 한국자동차모빌리티산업협회\n\n\n\n19.1/4 20.1/4 21.1/4 22.1/4 23.1/4 24.1/4\n\n\n주: 1) 자동차부품 포함\n2) 최근 10년 평균\n\n(2015.1/4분기~2024.4/4분기)\n자료: 통계청\n\n\n\n주: 1) 자동차부품 포함\n자료: 통계청\n\n\n\n25) 자동차 부품업체 동희산업 화재(10월), 현대 트랜시스 파업(10~11월), 폭설로 인한 기아차 화성공장 가동 중단\n\n(11.28~12.3일), 부품사 납품지연, 금속노조 파업(12월) 등\n26) 자동차 수출대수 증가율(%, 전년동기대비): 2024년 1/4분기 +0.6 → 2/4 +5.7 → 3/4 –5.1 → 4/4 +0.4\n27) 국산차 내수판매(%, 전년동기대비): 2024년 1/4분기 –11.7 → 2/4 -12.4 → 3/4 –4.0 → 4/4 -0.7 <24년 -7.4>\n28) 경기 부진에 따른 구매심리 위축 및 인기차종(경유모델) 단종으로 연중 내수판매가 부진하였으며, 하반기 중 상용차 수출도\n\n감소하면서 생산이 감소하였다. 상용차 생산 증가율(전년동기대비)은 2024년 1/4분기 –2.3%, 2/4분기 –14.2%, 3/4분기 –20.1%,\n4/4분기 –30.7%를 기록하였다.\n\n\n                       - 6\n\n[Document 4]\nMetadata: {\'page_count\': 39, \'format\': \'PDF 1.4\', \'quarter\': 4, \'subject\': \'\', \'creator\': \'Hwp 2018 10.0.0.10640\', \'author\': \'2010127\', \'has_images\': False, \'year\': 2024, \'modDate\': ""D:20250217103412+09\'00\'"", \'source\': \'2024_4사분기_주력산업_모니터링_보고서.pdf\', \'producer\': \'Hancom PDF 1.3.0.538\', \'page\': 13, \'file_path\': \'/workspaces/codespaces-jupyter/llmops_class/data/bok_major_industry_reports/2024_4사분기_주력산업_모니터링_보고서.pdf\', \'trapped\': \'\', \'title\': \'\', \'creationDate\': ""D:20250217103412+09\'00\'"", \'keywords\': \'\'}\nContent: 2024년 4/4분기 주력산업 모니터링 보고서(Ⅱ. 자동차)\n\n\n**5. 자동차 수출은 하이브리드차를 중심으로 북미 수요가 지속되겠으나, 유럽 판매 부진,**\n\n\n**미국의 관세정책에 대응한 현지생산 확대 등으로 감소할 것으로 예상된다.**\n\n\n**6. 국내 자동차 생산은 완만한 내수판매 회복세에도 불구하고 수출이 부진한 모습을 보이**\n\n\n**면서 전체적으로는 감소할 것으로 예상된다.**\n\n\n연간 자동차 생산 및 내수판매 전망 하향 미국의 보호무역주의 정책 강화\n\n\n[그림 2.7] 2025년 국내 자동차 생산·내수판매 전망 [1)] [표 2.1] 미 트럼프 정부의 주요 통상·산업정책\n\n\n\n0\n\n\n-2\n\n\n-4\n\n\n-6\n\n\n\n2\n\n\n0\n\n\n-2\n\n\n\n(%) (%)\n\n\n\n생산 내수\n\n\n\n|구 분|내 용|\n|---|---|\n|자국산업<br>보호<br>전기차<br>정책|·캐나다·멕시코 관세 25%<br>부과(2.4일부터 30일간 유예 중)<br>·중국 관세 10% 추가 부과(2.4일)<br>·보편관세 부과 및 기존 무역협정<br>재협상 검토<br>·전기차 의무화 목표(2030년까지 신차<br>판매의 50%) 폐지<br>·전기차 충전 인프라 구축 기금 집행<br>중단(50억달러)<br>·IRA 보조금 혜택 축소·폐지 검토|\n\n\n자료: 언론사 등\n\n\n\n\n\n\n\n\n\n\n\n\n\n\n\n주: 1) 전년동기대비 증감률\n자료: S&P Global Mobility\n\n\n\n43) 하이브리드차는 북미시장에서 국내 완성차업체들의 경쟁사 대비 낮은 가격 및 옵션 경쟁력, 전기차 대체수요에 따\n\n른 판매 증가 등으로 양호한 판매실적을 이어갈 것으로 기대된다.\n44) 트럼프 대통령은 취임 당일(1.20일) 행정명령을 통해 미국의 무역적자 원인과 리스크를 조사하고 해소방안을 마련하\n\n여 4.1일까지 보고하도록 지시하였다. 트럼프 1기 정부에서는 2018년 한미 FTA 재협상을 통해 픽업트럭에 대한 관\n세 철폐(25%→0%) 기한을 기존 2021년에서 2041년까지 20년 연장한 바 있다.\n45) 현대차그룹은 미국 조지아주 전기차 전용공장(메타플랜트) 가동을 본격화(연간 30만대 생산 가능)하는 한편 미국 전\n\n기차 정책 변화에 대응하여 전기차와 하이브리드차를 혼류 생산할 계획이다.\n46) EU는 올해부터 완성차 제조사가 판매하는 신차의 평균 이산화탄소 배출 가능 상한선을 약 18% 낮추고, 기준초과\n\n시 1g당 95유로의 벌금을 부과한다고 밝혔다.\n47) 다만 주요 완성차업체들이 전기차 캐즘 극복을 위해 중저가 전기차 모델 판매(캐스퍼EV, EV3, EV6 F/L)를 이어가는\n\n가운데, EU의 중국산 전기차에 대한 관세인상(24.10월 말)등은 친환경차 판매에 긍정적 요인이다.\n\n\n                       - 9\n\n']","2024년 4/4분기 자동차 수출(대수 기준)의 전년동기대비 증감률은 +0.4%입니다.  
(출처: 한국은행, 2024년 4/4분기 주력산업 모니터링 보고서 — 자동차 부문, 주석 26, p.10)","2024년 4/4분기 기준 자동차 수출(대수기준)은 전년동기대비 +0.4%로 소폭 증가했습니다. 보고서는 파업·폭설 등으로 일부 생산 차질이 있었음에도 유럽 및 중동지역에 대한 판매 증가로 인해 수출이 소폭 증가(+0.4%)로 전환되었고, 이러한 수출 증가가 전체적으로는 내수 부진 완화와 함께 자동차업계의 전체 판매 증가(+0.6%)로 이어졌다고 설명하고 있습니다.",0.8,0.9999999999,0.6666666666666666,0.7233811983159212,0.3719645936462387
2024년 1분기 기준 주요 수출 대상국별 철강제품 수출물량에서 미국으로의 전년동기대비 증감률은 얼마였나요?,"['[Document 1]\nMetadata: {\'page\': 20, \'title\': \'\', \'file_path\': \'/workspaces/codespaces-jupyter/llmops_class/data/bok_major_industry_reports/2024_1사분기_주력산업_모니터링_보고서.pdf\', \'page_count\': 38, \'quarter\': 1, \'keywords\': \'\', \'creationDate\': ""D:20240514181534+09\'00\'"", \'producer\': \'Hancom PDF 1.3.0.538\', \'source\': \'2024_1사분기_주력산업_모니터링_보고서.pdf\', \'author\': \'0510190\', \'year\': 2024, \'subject\': \'\', \'trapped\': \'\', \'format\': \'PDF 1.4\', \'modDate\': ""D:20240514181534+09\'00\'"", \'has_images\': False, \'creator\': \'Hwp 2018 10.0.0.10640\'}\nContent: 2024년 1/4분기 주력산업 모니터링 보고서(Ⅳ. 철강)\n\n\n철강제품 수출물량은 증가, 수출단가는 하락 철강제품 수출금액은 감소\n\n\n[그림 4.5] 철강제품 수출물량 및 단가 [1)] 추이 [그림 4.6] 철강제품 수출 추이\n\n\n\n주: 1) 한국무역통계진흥원 수출금액 및 수출물량 기준,\n\n자체 시산\n자료: 한국무역통계진흥원\n\n\n\n자료: 한국무역통계진흥원\n\n\n\n주요 수출 대상국별 철강제품 수출금액은 미국은 증가, 중국·일본·인도는 감소\n\n\n[표 4.1] 2024.1/4분기 주요 수출 대상국별 철강제품 수출 증가율\n\n\n(전년동기대비, %)\n**전체** **중국** **미국** **일본** **인도**\n수출금액 -5.6 -9.6 7.4 -7.7 -1.1\n수출물량 3.8 -9.5 46.5 6.3 14.6\n수출단가 -9.0 -0.1 -26.7 -13.1 -13.7\n\n###### 향후 전망\n\n\n**4. 향후 철강업 생산은 2024년 건설투자 부진** **[69)]** **, 주요국 금리 인하 지연 가능성, 중국**\n\n\n**부동산 경기 회복의 불확실성 등의 영향으로 다소 부진할 것으로 예상된다.**\n\n\n**5. 철강제품 수출은 물량 증가에도 불구하고 단가 하락의 영향이 지속되면서 회복세가**\n\n\n**다소 지연될 것으로 예상된다. 수출단가는 글로벌 경쟁 심화 등으로 하락압력을 받겠**\n\n\n**으나, 구체적 수준은 원재료 가격의 변동에도 영향을 받을 것으로 보인다.**\n\n\n69) 2024년 건설투자는 전년동기대비 2.6% 감소할 것으로 예상된다.(한국은행 경제전망보고서, 2024.2월)\n70) 세계철강협회는 글로벌 철강 수요가 2024년 1.7% 증가(2023.10월 전망치(+1.9%) 대비 0.2%p 하향 조정), 2025년\n\n1.2% 증가할 것으로 전망하였다. 한국 철강 수요는 2024년 0.8% 감소, 2025년 0.2% 증가할 것으로 전망하였\n다.(2024.4.17.일)\n\n\n                      - 16\n\n[Document 2]\nMetadata: {\'subject\': \'\', \'has_images\': False, \'trapped\': \'\', \'author\': \'0510190\', \'producer\': \'Hancom PDF 1.3.0.538\', \'file_path\': \'/workspaces/codespaces-jupyter/llmops_class/data/bok_major_industry_reports/2024_1사분기_주력산업_모니터링_보고서.pdf\', \'creationDate\': ""D:20240514181534+09\'00\'"", \'year\': 2024, \'page_count\': 38, \'title\': \'\', \'keywords\': \'\', \'modDate\': ""D:20240514181534+09\'00\'"", \'source\': \'2024_1사분기_주력산업_모니터링_보고서.pdf\', \'format\': \'PDF 1.4\', \'page\': 20, \'creator\': \'Hwp 2018 10.0.0.10640\', \'quarter\': 1}\nContent: 2024년 1/4분기 주력산업 모니터링 보고서(Ⅳ. 철강)\n\n\n철강제품 수출물량은 증가, 수출단가는 하락 철강제품 수출금액은 감소\n\n\n[그림 4.5] 철강제품 수출물량 및 단가 [1)] 추이 [그림 4.6] 철강제품 수출 추이\n\n\n\n주: 1) 한국무역통계진흥원 수출금액 및 수출물량 기준,\n\n자체 시산\n자료: 한국무역통계진흥원\n\n\n\n자료: 한국무역통계진흥원\n\n\n\n주요 수출 대상국별 철강제품 수출금액은 미국은 증가, 중국·일본·인도는 감소\n\n\n[표 4.1] 2024.1/4분기 주요 수출 대상국별 철강제품 수출 증가율\n\n\n(전년동기대비, %)\n**전체** **중국** **미국** **일본** **인도**\n수출금액 -5.6 -9.6 7.4 -7.7 -1.1\n수출물량 3.8 -9.5 46.5 6.3 14.6\n수출단가 -9.0 -0.1 -26.7 -13.1 -13.7\n\n###### 향후 전망\n\n\n**4. 향후 철강업 생산은 2024년 건설투자 부진** **[69)]** **, 주요국 금리 인하 지연 가능성, 중국**\n\n\n**부동산 경기 회복의 불확실성 등의 영향으로 다소 부진할 것으로 예상된다.**\n\n\n**5. 철강제품 수출은 물량 증가에도 불구하고 단가 하락의 영향이 지속되면서 회복세가**\n\n\n**다소 지연될 것으로 예상된다. 수출단가는 글로벌 경쟁 심화 등으로 하락압력을 받겠**\n\n\n**으나, 구체적 수준은 원재료 가격의 변동에도 영향을 받을 것으로 보인다.**\n\n\n69) 2024년 건설투자는 전년동기대비 2.6% 감소할 것으로 예상된다.(한국은행 경제전망보고서, 2024.2월)\n70) 세계철강협회는 글로벌 철강 수요가 2024년 1.7% 증가(2023.10월 전망치(+1.9%) 대비 0.2%p 하향 조정), 2025년\n\n1.2% 증가할 것으로 전망하였다. 한국 철강 수요는 2024년 0.8% 감소, 2025년 0.2% 증가할 것으로 전망하였\n다.(2024.4.17.일)\n\n\n                      - 16\n\n[Document 3]\nMetadata: {\'keywords\': \'\', \'file_path\': \'/workspaces/codespaces-jupyter/llmops_class/data/bok_major_industry_reports/2024_1사분기_주력산업_모니터링_보고서.pdf\', \'title\': \'\', \'trapped\': \'\', \'creator\': \'Hwp 2018 10.0.0.10640\', \'page_count\': 38, \'subject\': \'\', \'quarter\': 1, \'year\': 2024, \'page\': 20, \'author\': \'0510190\', \'format\': \'PDF 1.4\', \'source\': \'2024_1사분기_주력산업_모니터링_보고서.pdf\', \'has_images\': False, \'modDate\': ""D:20240514181534+09\'00\'"", \'creationDate\': ""D:20240514181534+09\'00\'"", \'producer\': \'Hancom PDF 1.3.0.538\'}\nContent: 2024년 1/4분기 주력산업 모니터링 보고서(Ⅳ. 철강)\n\n\n철강제품 수출물량은 증가, 수출단가는 하락 철강제품 수출금액은 감소\n\n\n[그림 4.5] 철강제품 수출물량 및 단가 [1)] 추이 [그림 4.6] 철강제품 수출 추이\n\n\n\n주: 1) 한국무역통계진흥원 수출금액 및 수출물량 기준,\n\n자체 시산\n자료: 한국무역통계진흥원\n\n\n\n자료: 한국무역통계진흥원\n\n\n\n주요 수출 대상국별 철강제품 수출금액은 미국은 증가, 중국·일본·인도는 감소\n\n\n[표 4.1] 2024.1/4분기 주요 수출 대상국별 철강제품 수출 증가율\n\n\n(전년동기대비, %)\n**전체** **중국** **미국** **일본** **인도**\n수출금액 -5.6 -9.6 7.4 -7.7 -1.1\n수출물량 3.8 -9.5 46.5 6.3 14.6\n수출단가 -9.0 -0.1 -26.7 -13.1 -13.7\n\n###### 향후 전망\n\n\n**4. 향후 철강업 생산은 2024년 건설투자 부진** **[69)]** **, 주요국 금리 인하 지연 가능성, 중국**\n\n\n**부동산 경기 회복의 불확실성 등의 영향으로 다소 부진할 것으로 예상된다.**\n\n\n**5. 철강제품 수출은 물량 증가에도 불구하고 단가 하락의 영향이 지속되면서 회복세가**\n\n\n**다소 지연될 것으로 예상된다. 수출단가는 글로벌 경쟁 심화 등으로 하락압력을 받겠**\n\n\n**으나, 구체적 수준은 원재료 가격의 변동에도 영향을 받을 것으로 보인다.**\n\n\n69) 2024년 건설투자는 전년동기대비 2.6% 감소할 것으로 예상된다.(한국은행 경제전망보고서, 2024.2월)\n70) 세계철강협회는 글로벌 철강 수요가 2024년 1.7% 증가(2023.10월 전망치(+1.9%) 대비 0.2%p 하향 조정), 2025년\n\n1.2% 증가할 것으로 전망하였다. 한국 철강 수요는 2024년 0.8% 감소, 2025년 0.2% 증가할 것으로 전망하였\n다.(2024.4.17.일)\n\n\n                      - 16\n\n[Document 4]\nMetadata: {\'file_path\': \'/workspaces/codespaces-jupyter/llmops_class/data/bok_major_industry_reports/2024_1사분기_주력산업_모니터링_보고서.pdf\', \'creationDate\': ""D:20240514181534+09\'00\'"", \'title\': \'\', \'page_count\': 38, \'page\': 21, \'trapped\': \'\', \'subject\': \'\', \'year\': 2024, \'producer\': \'Hancom PDF 1.3.0.538\', \'creator\': \'Hwp 2018 10.0.0.10640\', \'quarter\': 1, \'has_images\': False, \'format\': \'PDF 1.4\', \'keywords\': \'\', \'modDate\': ""D:20240514181534+09\'00\'"", \'author\': \'0510190\', \'source\': \'2024_1사분기_주력산업_모니터링_보고서.pdf\'}\nContent: 2024년 1/4분기 주력산업 모니터링 보고서(Ⅳ. 철강)\n\n\n**참고문헌**\n\n\n(2024), “Steel&Metal Weekly”\n\n\n(2024), “Steel Weekly”\n\n\nWorld Steel Association(2024), “Crude Steel Production”\n\n\nWorld Steel Association(2024), “Worldsteel Short Range Outlook April 2024”\n\n\n                      - 17\n\n']","2024년 1분기 기준 미국으로의 철강제품 수출물량은 전년동기대비 46.5% 증가했습니다. (출처: 한국은행, 2024년 1/4분기 주력산업 모니터링 보고서, 표 4.1, p.20)","2024년 1분기(2024.1/4분기) 기준 미국으로의 철강제품 수출물량은 전년동기대비 46.5% 증가하였다. 보고서는 중국향 물량 감소에도 불구하고 미국, 일본, 인도로의 수출물량이 증가한 점을 지적하며, 미국으로의 수출물량 증가가 특히 큰 폭임을 명시하고 있다.",0.75,0.9999999999,1.0,0.7578267633654314,0.4258768914472224
2024년 1분기 기준 석유화학제품 수출액은 전년동기대비 어떻게 변했나?,"['[Document 1]\nMetadata: {\'author\': \'0510190\', \'creator\': \'Hwp 2018 10.0.0.10640\', \'source\': \'2024_1사분기_주력산업_모니터링_보고서.pdf\', \'page_count\': 38, \'has_images\': False, \'subject\': \'\', \'year\': 2024, \'file_path\': \'/workspaces/codespaces-jupyter/llmops_class/data/bok_major_industry_reports/2024_1사분기_주력산업_모니터링_보고서.pdf\', \'keywords\': \'\', \'creationDate\': ""D:20240514181534+09\'00\'"", \'quarter\': 1, \'trapped\': \'\', \'format\': \'PDF 1.4\', \'page\': 15, \'producer\': \'Hancom PDF 1.3.0.538\', \'title\': \'\', \'modDate\': ""D:20240514181534+09\'00\'""}\nContent: 2024년 1/4분기 주력산업 모니터링 보고서(Ⅲ. 석유화학)\n\n\n**2. 석유화학제품 수출은 전년동기대비 0.3% 감소하였다.**\n\n\n석유화학제품 수출은 소폭 감소 석유화학제품 수출단가는 하락, 수출물량은 확대\n\n\n[그림 3.3] 석유화학제품 수출 [1)] [그림 3.4] 석유화학제품 수출 단가 [1)] 및 물량\n\n\n\n주: 1) 통관기준\n자료: 한국무역통계진흥원\n\n\n**對** 중국 석유화학제품 수출 부진 지속\n\n\n\n주: 1) (수출액)/(수출물량)\n자료: 한국무역통계진흥원\n\n\n[표 3.1] 지역별 석유화학제품 수출 [1)2)]\n\n\n\n(억달러, %)\n\n**2022년** **2023.4/4** **2024.1/4** **2024.3월**\n수출액 [100.0] 543.2 (-1.4) 112.0 (2.2) 120.0 (-0.3) 40.3 (-2.3)\n아시아 [67.2] 364.9 (-5.4) 78.4 (2.5) 76.9 (1.3) 25.0 (-2.6)\n(중 국) [38.1] 207.0 (-5.4) 43.6 (-6.3) 41.5 (-3.5) 13.2 (-6.6)\n(동남아) [18.3] 99.4 (-10.1) 20.9 (14.9) 21.7 (13.8) 7.3 (2.7)\n유 럽 [14.9] 81.2 (1.9) 16.3 (-2.7) 20.4 (-10.5) 6.8 (-12.5)\n북 미 [ 8.6] 46.8 (23.3) 7.8 (6.6) 12.1 (9.0) 5.0 (25.1)\n중남미 [ 4.1] 22.4 (0.0) 4.0 (4.8) 4.8 (2.8) 1.6 (-11.6)\n중 동 [ 2.9] 15.6 (22.9) 2.7 (-7.1) 2.9 (-14.4) 0.9 (-21.8)\n기 타 [ 2.3] 12.4 (-3.1) 2.7 (23.5) 2.9 (16.6) 1.1 (19.8)\n\n주: 1) MTI 2단위 21(석유화학제품) 기준\n2) ( )내는 전년동기대비 증가율, [ ]내는 2022년 비중\n자료: 한국무역통계진흥원\n\n\n48) 2024년 1/4분기 중 Dubai유는 81.5달러/배럴(분기 평균)로 전년동기대비 2.5% 상승하였다.\n49) 중동 지정학적 리스크(예멘 후티 반군의 상선 공격·이란과 이스라엘 충돌)로 해상운임(월평균 SCFI지수, 23.12월\n\n1097.9 → 24.1월 2025.5 → 2월 2168.3 → 3월 1842.6)이 큰 폭 상승해 유럽으로의 수출에 차질을 빚고 있다.\n50) 라마단 기간(3.10일~4.9일) 중 국내 석유화학제품을 중간재로 사용하는 중동 현지업체의 생산 감소 등이 영향을 주었다.\n51) 2024년 1/4분기 중 수출증감률(전년동기대비) : 기초유분 15.9%, 합섬원료 5.3%, 합성수지 –4.4%, 중간원료 –6.6%\n\n\n                      - 11\n\n[Document 2]\nMetadata: {\'page_count\': 38, \'quarter\': 1, \'has_images\': False, \'producer\': \'Hancom PDF 1.3.0.538\', \'title\': \'\', \'page\': 15, \'subject\': \'\', \'format\': \'PDF 1.4\', \'author\': \'0510190\', \'year\': 2024, \'creationDate\': ""D:20240514181534+09\'00\'"", \'keywords\': \'\', \'trapped\': \'\', \'creator\': \'Hwp 2018 10.0.0.10640\', \'file_path\': \'/workspaces/codespaces-jupyter/llmops_class/data/bok_major_industry_reports/2024_1사분기_주력산업_모니터링_보고서.pdf\', \'modDate\': ""D:20240514181534+09\'00\'"", \'source\': \'2024_1사분기_주력산업_모니터링_보고서.pdf\'}\nContent: 2024년 1/4분기 주력산업 모니터링 보고서(Ⅲ. 석유화학)\n\n\n**2. 석유화학제품 수출은 전년동기대비 0.3% 감소하였다.**\n\n\n석유화학제품 수출은 소폭 감소 석유화학제품 수출단가는 하락, 수출물량은 확대\n\n\n[그림 3.3] 석유화학제품 수출 [1)] [그림 3.4] 석유화학제품 수출 단가 [1)] 및 물량\n\n\n\n주: 1) 통관기준\n자료: 한국무역통계진흥원\n\n\n**對** 중국 석유화학제품 수출 부진 지속\n\n\n\n주: 1) (수출액)/(수출물량)\n자료: 한국무역통계진흥원\n\n\n[표 3.1] 지역별 석유화학제품 수출 [1)2)]\n\n\n\n(억달러, %)\n\n**2022년** **2023.4/4** **2024.1/4** **2024.3월**\n수출액 [100.0] 543.2 (-1.4) 112.0 (2.2) 120.0 (-0.3) 40.3 (-2.3)\n아시아 [67.2] 364.9 (-5.4) 78.4 (2.5) 76.9 (1.3) 25.0 (-2.6)\n(중 국) [38.1] 207.0 (-5.4) 43.6 (-6.3) 41.5 (-3.5) 13.2 (-6.6)\n(동남아) [18.3] 99.4 (-10.1) 20.9 (14.9) 21.7 (13.8) 7.3 (2.7)\n유 럽 [14.9] 81.2 (1.9) 16.3 (-2.7) 20.4 (-10.5) 6.8 (-12.5)\n북 미 [ 8.6] 46.8 (23.3) 7.8 (6.6) 12.1 (9.0) 5.0 (25.1)\n중남미 [ 4.1] 22.4 (0.0) 4.0 (4.8) 4.8 (2.8) 1.6 (-11.6)\n중 동 [ 2.9] 15.6 (22.9) 2.7 (-7.1) 2.9 (-14.4) 0.9 (-21.8)\n기 타 [ 2.3] 12.4 (-3.1) 2.7 (23.5) 2.9 (16.6) 1.1 (19.8)\n\n주: 1) MTI 2단위 21(석유화학제품) 기준\n2) ( )내는 전년동기대비 증가율, [ ]내는 2022년 비중\n자료: 한국무역통계진흥원\n\n\n48) 2024년 1/4분기 중 Dubai유는 81.5달러/배럴(분기 평균)로 전년동기대비 2.5% 상승하였다.\n49) 중동 지정학적 리스크(예멘 후티 반군의 상선 공격·이란과 이스라엘 충돌)로 해상운임(월평균 SCFI지수, 23.12월\n\n1097.9 → 24.1월 2025.5 → 2월 2168.3 → 3월 1842.6)이 큰 폭 상승해 유럽으로의 수출에 차질을 빚고 있다.\n50) 라마단 기간(3.10일~4.9일) 중 국내 석유화학제품을 중간재로 사용하는 중동 현지업체의 생산 감소 등이 영향을 주었다.\n51) 2024년 1/4분기 중 수출증감률(전년동기대비) : 기초유분 15.9%, 합섬원료 5.3%, 합성수지 –4.4%, 중간원료 –6.6%\n\n\n                      - 11\n\n[Document 3]\nMetadata: {\'source\': \'2024_1사분기_주력산업_모니터링_보고서.pdf\', \'producer\': \'Hancom PDF 1.3.0.538\', \'creator\': \'Hwp 2018 10.0.0.10640\', \'page\': 15, \'year\': 2024, \'page_count\': 38, \'title\': \'\', \'creationDate\': ""D:20240514181534+09\'00\'"", \'format\': \'PDF 1.4\', \'author\': \'0510190\', \'keywords\': \'\', \'subject\': \'\', \'has_images\': False, \'trapped\': \'\', \'modDate\': ""D:20240514181534+09\'00\'"", \'quarter\': 1, \'file_path\': \'/workspaces/codespaces-jupyter/llmops_class/data/bok_major_industry_reports/2024_1사분기_주력산업_모니터링_보고서.pdf\'}\nContent: 2024년 1/4분기 주력산업 모니터링 보고서(Ⅲ. 석유화학)\n\n\n**2. 석유화학제품 수출은 전년동기대비 0.3% 감소하였다.**\n\n\n석유화학제품 수출은 소폭 감소 석유화학제품 수출단가는 하락, 수출물량은 확대\n\n\n[그림 3.3] 석유화학제품 수출 [1)] [그림 3.4] 석유화학제품 수출 단가 [1)] 및 물량\n\n\n\n주: 1) 통관기준\n자료: 한국무역통계진흥원\n\n\n**對** 중국 석유화학제품 수출 부진 지속\n\n\n\n주: 1) (수출액)/(수출물량)\n자료: 한국무역통계진흥원\n\n\n[표 3.1] 지역별 석유화학제품 수출 [1)2)]\n\n\n\n(억달러, %)\n\n**2022년** **2023.4/4** **2024.1/4** **2024.3월**\n수출액 [100.0] 543.2 (-1.4) 112.0 (2.2) 120.0 (-0.3) 40.3 (-2.3)\n아시아 [67.2] 364.9 (-5.4) 78.4 (2.5) 76.9 (1.3) 25.0 (-2.6)\n(중 국) [38.1] 207.0 (-5.4) 43.6 (-6.3) 41.5 (-3.5) 13.2 (-6.6)\n(동남아) [18.3] 99.4 (-10.1) 20.9 (14.9) 21.7 (13.8) 7.3 (2.7)\n유 럽 [14.9] 81.2 (1.9) 16.3 (-2.7) 20.4 (-10.5) 6.8 (-12.5)\n북 미 [ 8.6] 46.8 (23.3) 7.8 (6.6) 12.1 (9.0) 5.0 (25.1)\n중남미 [ 4.1] 22.4 (0.0) 4.0 (4.8) 4.8 (2.8) 1.6 (-11.6)\n중 동 [ 2.9] 15.6 (22.9) 2.7 (-7.1) 2.9 (-14.4) 0.9 (-21.8)\n기 타 [ 2.3] 12.4 (-3.1) 2.7 (23.5) 2.9 (16.6) 1.1 (19.8)\n\n주: 1) MTI 2단위 21(석유화학제품) 기준\n2) ( )내는 전년동기대비 증가율, [ ]내는 2022년 비중\n자료: 한국무역통계진흥원\n\n\n48) 2024년 1/4분기 중 Dubai유는 81.5달러/배럴(분기 평균)로 전년동기대비 2.5% 상승하였다.\n49) 중동 지정학적 리스크(예멘 후티 반군의 상선 공격·이란과 이스라엘 충돌)로 해상운임(월평균 SCFI지수, 23.12월\n\n1097.9 → 24.1월 2025.5 → 2월 2168.3 → 3월 1842.6)이 큰 폭 상승해 유럽으로의 수출에 차질을 빚고 있다.\n50) 라마단 기간(3.10일~4.9일) 중 국내 석유화학제품을 중간재로 사용하는 중동 현지업체의 생산 감소 등이 영향을 주었다.\n51) 2024년 1/4분기 중 수출증감률(전년동기대비) : 기초유분 15.9%, 합섬원료 5.3%, 합성수지 –4.4%, 중간원료 –6.6%\n\n\n                      - 11\n\n[Document 4]\nMetadata: {\'page_count\': 38, \'format\': \'PDF 1.4\', \'keywords\': \'\', \'has_images\': False, \'modDate\': ""D:20240514181534+09\'00\'"", \'creationDate\': ""D:20240514181534+09\'00\'"", \'quarter\': 1, \'subject\': \'\', \'file_path\': \'/workspaces/codespaces-jupyter/llmops_class/data/bok_major_industry_reports/2024_1사분기_주력산업_모니터링_보고서.pdf\', \'title\': \'\', \'year\': 2024, \'creator\': \'Hwp 2018 10.0.0.10640\', \'source\': \'2024_1사분기_주력산업_모니터링_보고서.pdf\', \'author\': \'0510190\', \'producer\': \'Hancom PDF 1.3.0.538\', \'trapped\': \'\', \'page\': 14}\nContent: 2024년 1/4분기 주력산업 모니터링 보고서(Ⅲ. 석유화학)\n\n\n\n\n\n**1. 2024년 1/4분기 중 국내 석유화학산업 생산은 전년동기대비 3.0% 감소하며 부진한**\n\n\n**흐름을 이어나갔다.**\n\n\n석유화학 생산 감소 석유화학 가동률지수 하락\n\n\n[그림 3.1] 석유화학 생산지수 [그림 3.2] 석유화학 가동률지수\n\n\n자료: 통계청 자료: 통계청\n\n\n43) IMF(24.4월)는 2024년 중 전세계 경제성장률이 3.2%를 기록하며 과거 연평균 성장률(3.8%,\'00~\'19년)을 하회할 것으로\n\n내다보았다. 또한 IMF는 국내 석유화학제품 주요 수출국인 중국의 성장세가 2024년 중 둔화(23년 성장률 5.2% →\n24년 성장률 전망치 4.6%)될 것으로 전망하였다.\n44) 가전, 자동차 등 다양한 전방산업의 중간재로 사용되는 석유화학제품은 경기둔화에 따른 전방수요 약화에 직접적인\n\n영향을 받는다.\n45) 전세계 에틸렌 설비는 2020~2023년 4.3mmt 증가하였으나, 같은 기간 중 수요는 1.7mmt 증가에 그쳤다.\n46) 중국은 2020년부터 석유화학 생산설비를 본격적으로 증설해 2022년 중 생산능력 1위 국가(에틸렌 기준 생산능력,\n\n20년 3.2mmt → 21년 4.0mmt → 22년 4.6mmt → 23년 5.2mmt)로 부상하였다. 또한 중국의 석유화학제품 자급률이\n2025년 100%를 초과할 것으로 전망된다.\n47) NCC(나프타분해시설)와 ECC(에탄분해시설)의 에틸렌 생산원가 차이(NCC원가/톤-ECC원가/톤)는 유가가 50달러/배럴일\n\n때 230달러이며, 유가가 상승할수록 그 격차가 확대되어 NCC의 원가경쟁력이 저하된다.\n\n\n                      - 10\n\n']","2024년 1분기 석유화학제품 수출액은 전년동기대비 0.3% 감소했습니다. (수출액: 120.0억달러, 출처: 2024년 1/4분기 주력산업 모니터링 보고서 — 석유화학, 문서 1)","2024년 1분기 기준으로 석유화학제품 수출액은 전년동기대비 0.3% 감소하였다. 보고서는 수출물량은 기저효과 등으로 증가했으나(+6.4%), 수출단가가 공급과잉으로 하락(-6.2%)하면서 수출액이 소폭 감소했다고 설명하고 있다.",0.6666666666666666,0.9999999999,0.5,0.7221595227585235,0.41461737976255086
2024년 3/4분기 기준 ESS용 이차전지 수출 규모와 전년동기대비 증가율은 무엇인가?,"['[Document 1]\nMetadata: {\'modDate\': ""D:20241118151020+09\'00\'"", \'creator\': \'Hwp 2018 10.0.0.10640\', \'creationDate\': ""D:20241118151020+09\'00\'"", \'quarter\': 3, \'trapped\': \'\', \'page_count\': 39, \'file_path\': \'/workspaces/codespaces-jupyter/llmops_class/data/bok_major_industry_reports/2024_3사분기_주력산업_모니터링_보고서.pdf\', \'title\': \'\', \'subject\': \'\', \'page\': 35, \'producer\': \'Hancom PDF 1.3.0.538\', \'year\': 2024, \'keywords\': \'\', \'author\': \'0510190\', \'has_images\': False, \'format\': \'PDF 1.4\', \'source\': \'2024_3사분기_주력산업_모니터링_보고서.pdf\'}\nContent: 2024년 3/4분기 주력산업 모니터링 보고서(Ⅷ. 이차전지)\n\n\n\n\n###### 최근 동향\n\n**1. 2024년 3/4분기 중 이차전지 및 양극재(이차전지 주요 소재) 수출은 각각 전년동기대비**\n\n\n**9.3%, 59.5% 줄어들면서 감소세가 지속되었다.**\n\n\n이차전지 수출은 감소폭이 축소된 반면, 양극재(이차전지 주요 소재) 수출은 큰 폭의 감소세 지속\n\n\n[그림 8.1] 이차전지 수출 [그림 8.2] 양극재 수출\n\n\n자료: 한국무역통계진흥원 자료: 한국무역통계진흥원\n\n\n**2. 이차전지 수출의 감소폭 축소는 유럽시장 부진에도 불구하고 미국시장에서 ESS(Energy**\n\n\n**Storage System, 에너지 저장장치)용 전지에 대한 수요가 크게 늘어난 데 주로 기인한다.**\n\n\n88) 2023년 중 우리나라 이차전지 수출의 국가별 비중은 미국 57.0%, 유럽 20.3% 등의 순이다.\n\n\n                      - 31\n\n[Document 2]\nMetadata: {\'creator\': \'Hwp 2018 10.0.0.10640\', \'author\': \'0510190\', \'source\': \'2024_3사분기_주력산업_모니터링_보고서.pdf\', \'modDate\': ""D:20241118151020+09\'00\'"", \'trapped\': \'\', \'page_count\': 39, \'year\': 2024, \'page\': 35, \'keywords\': \'\', \'subject\': \'\', \'format\': \'PDF 1.4\', \'quarter\': 3, \'has_images\': False, \'creationDate\': ""D:20241118151020+09\'00\'"", \'file_path\': \'/workspaces/codespaces-jupyter/llmops_class/data/bok_major_industry_reports/2024_3사분기_주력산업_모니터링_보고서.pdf\', \'producer\': \'Hancom PDF 1.3.0.538\', \'title\': \'\'}\nContent: 2024년 3/4분기 주력산업 모니터링 보고서(Ⅷ. 이차전지)\n\n\n\n\n###### 최근 동향\n\n**1. 2024년 3/4분기 중 이차전지 및 양극재(이차전지 주요 소재) 수출은 각각 전년동기대비**\n\n\n**9.3%, 59.5% 줄어들면서 감소세가 지속되었다.**\n\n\n이차전지 수출은 감소폭이 축소된 반면, 양극재(이차전지 주요 소재) 수출은 큰 폭의 감소세 지속\n\n\n[그림 8.1] 이차전지 수출 [그림 8.2] 양극재 수출\n\n\n자료: 한국무역통계진흥원 자료: 한국무역통계진흥원\n\n\n**2. 이차전지 수출의 감소폭 축소는 유럽시장 부진에도 불구하고 미국시장에서 ESS(Energy**\n\n\n**Storage System, 에너지 저장장치)용 전지에 대한 수요가 크게 늘어난 데 주로 기인한다.**\n\n\n88) 2023년 중 우리나라 이차전지 수출의 국가별 비중은 미국 57.0%, 유럽 20.3% 등의 순이다.\n\n\n                      - 31\n\n[Document 3]\nMetadata: {\'has_images\': False, \'creationDate\': ""D:20241118151020+09\'00\'"", \'author\': \'0510190\', \'page\': 35, \'keywords\': \'\', \'modDate\': ""D:20241118151020+09\'00\'"", \'title\': \'\', \'source\': \'2024_3사분기_주력산업_모니터링_보고서.pdf\', \'subject\': \'\', \'producer\': \'Hancom PDF 1.3.0.538\', \'page_count\': 39, \'format\': \'PDF 1.4\', \'creator\': \'Hwp 2018 10.0.0.10640\', \'file_path\': \'/workspaces/codespaces-jupyter/llmops_class/data/bok_major_industry_reports/2024_3사분기_주력산업_모니터링_보고서.pdf\', \'trapped\': \'\', \'year\': 2024, \'quarter\': 3}\nContent: 2024년 3/4분기 주력산업 모니터링 보고서(Ⅷ. 이차전지)\n\n\n\n\n###### 최근 동향\n\n**1. 2024년 3/4분기 중 이차전지 및 양극재(이차전지 주요 소재) 수출은 각각 전년동기대비**\n\n\n**9.3%, 59.5% 줄어들면서 감소세가 지속되었다.**\n\n\n이차전지 수출은 감소폭이 축소된 반면, 양극재(이차전지 주요 소재) 수출은 큰 폭의 감소세 지속\n\n\n[그림 8.1] 이차전지 수출 [그림 8.2] 양극재 수출\n\n\n자료: 한국무역통계진흥원 자료: 한국무역통계진흥원\n\n\n**2. 이차전지 수출의 감소폭 축소는 유럽시장 부진에도 불구하고 미국시장에서 ESS(Energy**\n\n\n**Storage System, 에너지 저장장치)용 전지에 대한 수요가 크게 늘어난 데 주로 기인한다.**\n\n\n88) 2023년 중 우리나라 이차전지 수출의 국가별 비중은 미국 57.0%, 유럽 20.3% 등의 순이다.\n\n\n                      - 31\n\n[Document 4]\nMetadata: {\'format\': \'PDF 1.4\', \'trapped\': \'\', \'keywords\': \'\', \'creationDate\': ""D:20241118151020+09\'00\'"", \'has_images\': False, \'page_count\': 39, \'title\': \'\', \'file_path\': \'/workspaces/codespaces-jupyter/llmops_class/data/bok_major_industry_reports/2024_3사분기_주력산업_모니터링_보고서.pdf\', \'year\': 2024, \'modDate\': ""D:20241118151020+09\'00\'"", \'subject\': \'\', \'creator\': \'Hwp 2018 10.0.0.10640\', \'author\': \'0510190\', \'source\': \'2024_3사분기_주력산업_모니터링_보고서.pdf\', \'quarter\': 3, \'page\': 36, \'producer\': \'Hancom PDF 1.3.0.538\'}\nContent: 2024년 3/4분기 주력산업 모니터링 보고서(Ⅷ. 이차전지)\n\n\n미국으로의 이차전지 수출이 증가로 전환 ESS용 이차전지 수출이 큰 폭으로 증가\n\n\n[표 8.1] 우리나라의 국가별 이차전지 수출 [1)] [표 8.2] 우리나라의 용도별 이차전지 수출 [1)]\n\n\n\n(억달러, %)\n\n\n\n\n\n|Col1|2024.2/4분기|Col3|3/4분기|Col5|\n|---|---|---|---|---|\n|미국|5.8|(-47.7)|9.6|(11.2)|\n|유럽<br>중국|2.6<br>0.5|(-25.8)<br>(-21.0)|1.9<br>0.9|(-38.5)<br>(27.3)|\n\n\n|Col1|Col2|Col3|Col4|(억달러, %)|Col6|\n|---|---|---|---|---|---|\n|이차전지<br>EV<br>ESS|이차전지<br>EV<br>ESS|2024.2/4분기<br>13.2<br>(-29.4)<br>3.5<br>(-50.3)|2024.2/4분기<br>13.2<br>(-29.4)<br>3.5<br>(-50.3)|3/4분기<br>14.5<br>(-9.3)<br>1.9<br>(-71.1)|3/4분기<br>14.5<br>(-9.3)<br>1.9<br>(-71.1)|\n|이차전지<br>EV<br>ESS|ESS|6.8|(7.9)|8.9|(70.8)|\n\n\n주: 1) ( )내는 전년동기대비 증가율 주: 1) ( )내는 전년동기대비 증가율\n자료: 한국무역통계진흥원 자료: 한국무역통계진흥원\n\n\n\n\n\n주: 1) ( )내는 전년동기대비 증가율\n자료: 한국무역통계진흥원\n\n\n\n**3. 양극재 수출은 유럽, 중국, 미국 등 주요 대상국에 대한 큰 폭의 감소세가 지속되었다.**\n\n\n주요 수출국으로의 양극재 수출이 큰 폭으로 감소 유럽지역 전기차 판매량이 감소\n\n\n[표 8.3] 우리나라의 국가별 양극재 수출 [1)] [표 8.4] 글로벌 전기차 인도량\n\n\n\n(억달러, %)\n\n\n주: 1) ( )내는 전년동기대비 증가율\n자료: 한국무역통계진흥원\n\n\n\n(전년동기대비, %)\n\n\n자료: SNE Research\n\n\n\n89) 신재생에너지는 전력 생산이 불안정하기 때문에 생산된 전력을 보관하는 에너지저장장치의 설치가 필수적이다.\n90) 2023년 중 우리나라 양극재 수출의 국가별 비중은 유럽 45.9%, 중국 36.6% 등의 순이다.\n\n\n                      - 32\n\n']","2024년 3/4분기 ESS용 이차전지 수출은 8.9억달러이며, 전년동기대비 증가율은 +70.8%입니다.  
(출처: 2024년 3/4분기 주력산업 모니터링 보고서 — 이차전지 분야, 표 8.2, 문서 4)","2024년 3/4분기 기준 ESS용 이차전지 수출은 8.9억달러이며, 전년동기대비 증가율은 +70.8%로 보고되었다. 이는 보고서의 용도별 이차전지 수출표(표 8.2)에 기재된 수치로, 같은 표에서 EV용은 감소한 반면 ESS용은 큰 폭으로 증가한 것으로 나타난다.",0.6666666666666666,0.9999999999,1.0,0.7382757183319307,0.786833743832467
"2024년 2/4분기 기준 반도체 수출 증가의 주된 원인은 무엇이며, 그 각각이 어떻게 기여했나요?","['[Document 1]\nMetadata: {\'format\': \'PDF 1.4\', \'has_images\': False, \'trapped\': \'\', \'modDate\': ""D:20240809153829+09\'00\'"", \'subject\': \'\', \'year\': 2024, \'title\': \'\', \'producer\': \'Hancom PDF 1.3.0.538\', \'page\': 5, \'source\': \'2024_2사분기_주력산업_모니터링_보고서.pdf\', \'creator\': \'Hwp 2018 10.0.0.10640\', \'author\': \'0510190\', \'file_path\': \'/workspaces/codespaces-jupyter/llmops_class/data/bok_major_industry_reports/2024_2사분기_주력산업_모니터링_보고서.pdf\', \'keywords\': \'\', \'creationDate\': ""D:20240809153829+09\'00\'"", \'page_count\': 38, \'quarter\': 2}\nContent: 2024년 2/4분기 주력산업 모니터링 보고서(Ⅰ. 반도체)\n\n#### <산업별 모니터링 결과><산업별 모니터링 결과>\n\n\n\n\n\n**1. 2024년 2/4분기 중 반도체 수출은 전년동기대비 53.5% 증가하면서 증가세(전분기 +50.7%)가**\n\n\n**확대되었다. 메모리반도체(+93.6%)가 수출 증가를 주도한 가운데,** **시스템반도체(+13.1%)**\n\n\n**의 증가도 가세하였다.**\n\n\n반도체 수출 호조 지속 반도체 생산은 증가세 축소\n\n\n[그림 1.1] 반도체 수출 [그림 1.2] 반도체 생산\n\n\n자료: 한국무역통계진흥원 자료: 한국은행, 통계청\n\n\n1) AI 반도체 시장 전망(십억불, Gartner) : (2022) 42.2 →(2023) 53.7 →(2024 [e] ) 84.3 →(2025 [e] ) 114.0 →(2026 [e] ) 144.2 →(2027 [e] ) 173.9\n2) 2024.2/4분기 중 반도체 수출물가지수(계약가격기준)는 전분기대비 9.9% 상승(전년동기대비 +42.4%)하였다.\n3) 2024.2/4분기 중 반도체 수출물량은 전분기대비 4.6% 증가(전년동기대비 +14.8%)하였다.(한국무역통계진흥원)\n4) 경기지역 전자･영상･음향･통신 부문 재고 증감율 : (2월) -13.4% →(3월) -16.7% →(4월 [p] ) -28.8% →(5월 [p] ) -28.8%\n\n\n                       - 1\n\n[Document 2]\nMetadata: {\'producer\': \'Hancom PDF 1.3.0.538\', \'format\': \'PDF 1.4\', \'quarter\': 2, \'file_path\': \'/workspaces/codespaces-jupyter/llmops_class/data/bok_major_industry_reports/2024_2사분기_주력산업_모니터링_보고서.pdf\', \'subject\': \'\', \'page\': 5, \'title\': \'\', \'trapped\': \'\', \'creationDate\': ""D:20240809153829+09\'00\'"", \'modDate\': ""D:20240809153829+09\'00\'"", \'year\': 2024, \'author\': \'0510190\', \'source\': \'2024_2사분기_주력산업_모니터링_보고서.pdf\', \'page_count\': 38, \'keywords\': \'\', \'has_images\': False, \'creator\': \'Hwp 2018 10.0.0.10640\'}\nContent: 2024년 2/4분기 주력산업 모니터링 보고서(Ⅰ. 반도체)\n\n#### <산업별 모니터링 결과><산업별 모니터링 결과>\n\n\n\n\n\n**1. 2024년 2/4분기 중 반도체 수출은 전년동기대비 53.5% 증가하면서 증가세(전분기 +50.7%)가**\n\n\n**확대되었다. 메모리반도체(+93.6%)가 수출 증가를 주도한 가운데,** **시스템반도체(+13.1%)**\n\n\n**의 증가도 가세하였다.**\n\n\n반도체 수출 호조 지속 반도체 생산은 증가세 축소\n\n\n[그림 1.1] 반도체 수출 [그림 1.2] 반도체 생산\n\n\n자료: 한국무역통계진흥원 자료: 한국은행, 통계청\n\n\n1) AI 반도체 시장 전망(십억불, Gartner) : (2022) 42.2 →(2023) 53.7 →(2024 [e] ) 84.3 →(2025 [e] ) 114.0 →(2026 [e] ) 144.2 →(2027 [e] ) 173.9\n2) 2024.2/4분기 중 반도체 수출물가지수(계약가격기준)는 전분기대비 9.9% 상승(전년동기대비 +42.4%)하였다.\n3) 2024.2/4분기 중 반도체 수출물량은 전분기대비 4.6% 증가(전년동기대비 +14.8%)하였다.(한국무역통계진흥원)\n4) 경기지역 전자･영상･음향･통신 부문 재고 증감율 : (2월) -13.4% →(3월) -16.7% →(4월 [p] ) -28.8% →(5월 [p] ) -28.8%\n\n\n                       - 1\n\n[Document 3]\nMetadata: {\'source\': \'2024_2사분기_주력산업_모니터링_보고서.pdf\', \'trapped\': \'\', \'file_path\': \'/workspaces/codespaces-jupyter/llmops_class/data/bok_major_industry_reports/2024_2사분기_주력산업_모니터링_보고서.pdf\', \'quarter\': 2, \'page\': 5, \'creator\': \'Hwp 2018 10.0.0.10640\', \'modDate\': ""D:20240809153829+09\'00\'"", \'year\': 2024, \'keywords\': \'\', \'producer\': \'Hancom PDF 1.3.0.538\', \'author\': \'0510190\', \'creationDate\': ""D:20240809153829+09\'00\'"", \'format\': \'PDF 1.4\', \'has_images\': False, \'title\': \'\', \'subject\': \'\', \'page_count\': 38}\nContent: 2024년 2/4분기 주력산업 모니터링 보고서(Ⅰ. 반도체)\n\n#### <산업별 모니터링 결과><산업별 모니터링 결과>\n\n\n\n\n\n**1. 2024년 2/4분기 중 반도체 수출은 전년동기대비 53.5% 증가하면서 증가세(전분기 +50.7%)가**\n\n\n**확대되었다. 메모리반도체(+93.6%)가 수출 증가를 주도한 가운데,** **시스템반도체(+13.1%)**\n\n\n**의 증가도 가세하였다.**\n\n\n반도체 수출 호조 지속 반도체 생산은 증가세 축소\n\n\n[그림 1.1] 반도체 수출 [그림 1.2] 반도체 생산\n\n\n자료: 한국무역통계진흥원 자료: 한국은행, 통계청\n\n\n1) AI 반도체 시장 전망(십억불, Gartner) : (2022) 42.2 →(2023) 53.7 →(2024 [e] ) 84.3 →(2025 [e] ) 114.0 →(2026 [e] ) 144.2 →(2027 [e] ) 173.9\n2) 2024.2/4분기 중 반도체 수출물가지수(계약가격기준)는 전분기대비 9.9% 상승(전년동기대비 +42.4%)하였다.\n3) 2024.2/4분기 중 반도체 수출물량은 전분기대비 4.6% 증가(전년동기대비 +14.8%)하였다.(한국무역통계진흥원)\n4) 경기지역 전자･영상･음향･통신 부문 재고 증감율 : (2월) -13.4% →(3월) -16.7% →(4월 [p] ) -28.8% →(5월 [p] ) -28.8%\n\n\n                       - 1\n\n[Document 4]\nMetadata: {\'page\': 30, \'keywords\': \'\', \'quarter\': 2, \'modDate\': ""D:20240809153829+09\'00\'"", \'format\': \'PDF 1.4\', \'file_path\': \'/workspaces/codespaces-jupyter/llmops_class/data/bok_major_industry_reports/2024_2사분기_주력산업_모니터링_보고서.pdf\', \'source\': \'2024_2사분기_주력산업_모니터링_보고서.pdf\', \'producer\': \'Hancom PDF 1.3.0.538\', \'creationDate\': ""D:20240809153829+09\'00\'"", \'subject\': \'\', \'year\': 2024, \'has_images\': False, \'creator\': \'Hwp 2018 10.0.0.10640\', \'page_count\': 38, \'trapped\': \'\', \'title\': \'\', \'author\': \'0510190\'}\nContent: 2024년 2/4분기 주력산업 모니터링 보고서(Ⅶ. 휴대폰)\n\n\n\n\n###### 최근 동향\n\n**1. 2024.2/4분기 중 휴대폰 및 부품 수출은 완제품이 10.5% 감소한 반면 부품은**\n\n\n**23.9% 늘어나 전년동기대비 12.0% 증가하였다.**\n\n\n휴대폰 및 부품 수출은 전년동기대비 12.0% 증가 완제품 수출은 감소하였으나 부품 수출은 증가\n\n\n[그림 7.1] 휴대폰 및 부품 수출 [표 7.1] 2024.2/4분기 휴대폰 및 부품 수출\n\n\n(단위: 억달러, 전년동기대비, %)\n\n|Col1|완제품|Col3|부품|Col5|\n|---|---|---|---|---|\n||**금액**|**증가율**|**금액**|**증가율**|\n|미 국<br>0.10<br>(-96.6)<br>0.42<br>(39.7)<br>E  U1)<br>4.97<br>(-4.0)<br>0.71<br>(16.4)<br>중 국2)<br>0.33<br>(5.2)<br>11.57<br>(20.0)<br>베트남<br>0.05<br>(21.1)<br>5.51<br>(15.8)<br>인 도<br>0.01<br>(-38.8)<br>0.65<br>(5.7)<br>전 체<br>7.96<br>(-10.5)<br>20.81<br>(23.9)|미 국<br>0.10<br>(-96.6)<br>0.42<br>(39.7)<br>E  U1)<br>4.97<br>(-4.0)<br>0.71<br>(16.4)<br>중 국2)<br>0.33<br>(5.2)<br>11.57<br>(20.0)<br>베트남<br>0.05<br>(21.1)<br>5.51<br>(15.8)<br>인 도<br>0.01<br>(-38.8)<br>0.65<br>(5.7)<br>전 체<br>7.96<br>(-10.5)<br>20.81<br>(23.9)|미 국<br>0.10<br>(-96.6)<br>0.42<br>(39.7)<br>E  U1)<br>4.97<br>(-4.0)<br>0.71<br>(16.4)<br>중 국2)<br>0.33<br>(5.2)<br>11.57<br>(20.0)<br>베트남<br>0.05<br>(21.1)<br>5.51<br>(15.8)<br>인 도<br>0.01<br>(-38.8)<br>0.65<br>(5.7)<br>전 체<br>7.96<br>(-10.5)<br>20.81<br>(23.9)|미 국<br>0.10<br>(-96.6)<br>0.42<br>(39.7)<br>E  U1)<br>4.97<br>(-4.0)<br>0.71<br>(16.4)<br>중 국2)<br>0.33<br>(5.2)<br>11.57<br>(20.0)<br>베트남<br>0.05<br>(21.1)<br>5.51<br>(15.8)<br>인 도<br>0.01<br>(-38.8)<br>0.65<br>(5.7)<br>전 체<br>7.96<br>(-10.5)<br>20.81<br>(23.9)|미 국<br>0.10<br>(-96.6)<br>0.42<br>(39.7)<br>E  U1)<br>4.97<br>(-4.0)<br>0.71<br>(16.4)<br>중 국2)<br>0.33<br>(5.2)<br>11.57<br>(20.0)<br>베트남<br>0.05<br>(21.1)<br>5.51<br>(15.8)<br>인 도<br>0.01<br>(-38.8)<br>0.65<br>(5.7)<br>전 체<br>7.96<br>(-10.5)<br>20.81<br>(23.9)|\n\n\n\n자료: 한국무역통계진흥원 주: 1) 영국 포함,  2) 홍콩, 마카오 포함\n자료: 한국무역통계진흥원\n\n\n88) 최근 삼성전자 등 글로벌 기업은 글로벌 통상 여건 변화에 대응하여 세계 각지에 분포한 생산기지의 생산물량을 유\n\n', '[Document 1]\nMetadata: {\'keywords\': \'\', \'creationDate\': ""D:20240809153829+09\'00\'"", \'creator\': \'Hwp 2018 10.0.0.10640\', \'page\': 5, \'author\': \'0510190\', \'format\': \'PDF 1.4\', \'title\': \'\', \'quarter\': 2, \'year\': 2024, \'subject\': \'\', \'source\': \'2024_2사분기_주력산업_모니터링_보고서.pdf\', \'page_count\': 38, \'file_path\': \'/workspaces/codespaces-jupyter/llmops_class/data/bok_major_industry_reports/2024_2사분기_주력산업_모니터링_보고서.pdf\', \'trapped\': \'\', \'has_images\': False, \'modDate\': ""D:20240809153829+09\'00\'"", \'producer\': \'Hancom PDF 1.3.0.538\'}\nContent: 2024년 2/4분기 주력산업 모니터링 보고서(Ⅰ. 반도체)\n\n#### <산업별 모니터링 결과><산업별 모니터링 결과>\n\n\n\n\n\n**1. 2024년 2/4분기 중 반도체 수출은 전년동기대비 53.5% 증가하면서 증가세(전분기 +50.7%)가**\n\n\n**확대되었다. 메모리반도체(+93.6%)가 수출 증가를 주도한 가운데,** **시스템반도체(+13.1%)**\n\n\n**의 증가도 가세하였다.**\n\n\n반도체 수출 호조 지속 반도체 생산은 증가세 축소\n\n\n[그림 1.1] 반도체 수출 [그림 1.2] 반도체 생산\n\n\n자료: 한국무역통계진흥원 자료: 한국은행, 통계청\n\n\n1) AI 반도체 시장 전망(십억불, Gartner) : (2022) 42.2 →(2023) 53.7 →(2024 [e] ) 84.3 →(2025 [e] ) 114.0 →(2026 [e] ) 144.2 →(2027 [e] ) 173.9\n2) 2024.2/4분기 중 반도체 수출물가지수(계약가격기준)는 전분기대비 9.9% 상승(전년동기대비 +42.4%)하였다.\n3) 2024.2/4분기 중 반도체 수출물량은 전분기대비 4.6% 증가(전년동기대비 +14.8%)하였다.(한국무역통계진흥원)\n4) 경기지역 전자･영상･음향･통신 부문 재고 증감율 : (2월) -13.4% →(3월) -16.7% →(4월 [p] ) -28.8% →(5월 [p] ) -28.8%\n\n\n                       - 1\n\n[Document 2]\nMetadata: {\'has_images\': False, \'file_path\': \'/workspaces/codespaces-jupyter/llmops_class/data/bok_major_industry_reports/2024_2사분기_주력산업_모니터링_보고서.pdf\', \'creator\': \'Hwp 2018 10.0.0.10640\', \'source\': \'2024_2사분기_주력산업_모니터링_보고서.pdf\', \'page\': 5, \'quarter\': 2, \'format\': \'PDF 1.4\', \'author\': \'0510190\', \'year\': 2024, \'modDate\': ""D:20240809153829+09\'00\'"", \'title\': \'\', \'trapped\': \'\', \'creationDate\': ""D:20240809153829+09\'00\'"", \'producer\': \'Hancom PDF 1.3.0.538\', \'keywords\': \'\', \'subject\': \'\', \'page_count\': 38}\nContent: 2024년 2/4분기 주력산업 모니터링 보고서(Ⅰ. 반도체)\n\n#### <산업별 모니터링 결과><산업별 모니터링 결과>\n\n\n\n\n\n**1. 2024년 2/4분기 중 반도체 수출은 전년동기대비 53.5% 증가하면서 증가세(전분기 +50.7%)가**\n\n\n**확대되었다. 메모리반도체(+93.6%)가 수출 증가를 주도한 가운데,** **시스템반도체(+13.1%)**\n\n\n**의 증가도 가세하였다.**\n\n\n반도체 수출 호조 지속 반도체 생산은 증가세 축소\n\n\n[그림 1.1] 반도체 수출 [그림 1.2] 반도체 생산\n\n\n자료: 한국무역통계진흥원 자료: 한국은행, 통계청\n\n\n1) AI 반도체 시장 전망(십억불, Gartner) : (2022) 42.2 →(2023) 53.7 →(2024 [e] ) 84.3 →(2025 [e] ) 114.0 →(2026 [e] ) 144.2 →(2027 [e] ) 173.9\n2) 2024.2/4분기 중 반도체 수출물가지수(계약가격기준)는 전분기대비 9.9% 상승(전년동기대비 +42.4%)하였다.\n3) 2024.2/4분기 중 반도체 수출물량은 전분기대비 4.6% 증가(전년동기대비 +14.8%)하였다.(한국무역통계진흥원)\n4) 경기지역 전자･영상･음향･통신 부문 재고 증감율 : (2월) -13.4% →(3월) -16.7% →(4월 [p] ) -28.8% →(5월 [p] ) -28.8%\n\n\n                       - 1\n\n[Document 3]\nMetadata: {\'subject\': \'\', \'year\': 2024, \'creationDate\': ""D:20240809153829+09\'00\'"", \'trapped\': \'\', \'page_count\': 38, \'producer\': \'Hancom PDF 1.3.0.538\', \'creator\': \'Hwp 2018 10.0.0.10640\', \'file_path\': \'/workspaces/codespaces-jupyter/llmops_class/data/bok_major_industry_reports/2024_2사분기_주력산업_모니터링_보고서.pdf\', \'keywords\': \'\', \'modDate\': ""D:20240809153829+09\'00\'"", \'source\': \'2024_2사분기_주력산업_모니터링_보고서.pdf\', \'quarter\': 2, \'title\': \'\', \'has_images\': False, \'page\': 5, \'format\': \'PDF 1.4\', \'author\': \'0510190\'}\nContent: 2024년 2/4분기 주력산업 모니터링 보고서(Ⅰ. 반도체)\n\n#### <산업별 모니터링 결과><산업별 모니터링 결과>\n\n\n\n\n\n**1. 2024년 2/4분기 중 반도체 수출은 전년동기대비 53.5% 증가하면서 증가세(전분기 +50.7%)가**\n\n\n**확대되었다. 메모리반도체(+93.6%)가 수출 증가를 주도한 가운데,** **시스템반도체(+13.1%)**\n\n\n**의 증가도 가세하였다.**\n\n\n반도체 수출 호조 지속 반도체 생산은 증가세 축소\n\n\n[그림 1.1] 반도체 수출 [그림 1.2] 반도체 생산\n\n\n자료: 한국무역통계진흥원 자료: 한국은행, 통계청\n\n\n1) AI 반도체 시장 전망(십억불, Gartner) : (2022) 42.2 →(2023) 53.7 →(2024 [e] ) 84.3 →(2025 [e] ) 114.0 →(2026 [e] ) 144.2 →(2027 [e] ) 173.9\n2) 2024.2/4분기 중 반도체 수출물가지수(계약가격기준)는 전분기대비 9.9% 상승(전년동기대비 +42.4%)하였다.\n3) 2024.2/4분기 중 반도체 수출물량은 전분기대비 4.6% 증가(전년동기대비 +14.8%)하였다.(한국무역통계진흥원)\n4) 경기지역 전자･영상･음향･통신 부문 재고 증감율 : (2월) -13.4% →(3월) -16.7% →(4월 [p] ) -28.8% →(5월 [p] ) -28.8%\n\n\n                       - 1\n\n[Document 4]\nMetadata: {\'modDate\': ""D:20240809153829+09\'00\'"", \'producer\': \'Hancom PDF 1.3.0.538\', \'page_count\': 38, \'keywords\': \'\', \'page\': 6, \'subject\': \'\', \'source\': \'2024_2사분기_주력산업_모니터링_보고서.pdf\', \'creator\': \'Hwp 2018 10.0.0.10640\', \'title\': \'\', \'file_path\': \'/workspaces/codespaces-jupyter/llmops_class/data/bok_major_industry_reports/2024_2사분기_주력산업_모니터링_보고서.pdf\', \'creationDate\': ""D:20240809153829+09\'00\'"", \'format\': \'PDF 1.4\', \'has_images\': False, \'year\': 2024, \'author\': \'0510190\', \'trapped\': \'\', \'quarter\': 2}\nContent: 2024년 2/4분기 주력산업 모니터링 보고서(Ⅰ. 반도체)\n\n\n**2. 2/4분기 중 메모리반도체(D램 및 낸드플래시) 고정거래가격은 D램의 경우 전분기말대비**\n\n\n**상승하였으며 낸드플래시는 보합세를 유지하였다.** **[5)]** **현물가격의 경우 D램** **[6)]** **은 상승한 반**\n\n\n**면, 낸드플래시는 소폭 하락하였다.**\n\n\n**3. 동 기간중 국내 반도체 대기업(삼성전자, SK하이닉스)** **매출액(전년동기대비 각각 +93.9%, +124.8%)**\n\n\n**및 영업이익(+247.9%, +289.8%)은 AI 서버용 제품(HBM, LPDDR** **[7)]** **, eSSD** **[8)]** **) 수요 호조, 범용 메모리반도**\n\n\n**체 수요 회복에 따른 평균판매가격 상승 등에 힘입어 큰 폭 증가하였다.**\n\n\n메모리반도체 품목별 가격 상승세 차별화 국내 반도체 대기업의 매출액 및 영업이익 증가세 확대\n\n\n[그림 1.3] 메모리 반도체 고정거래 및 현물가격 [표 1.1] 반도체 기업 실적 [1)]\n\n\n(단위 : 조원, %)\n\n\n\n삼\n성\n전\n자 [2)]\n\n\n\n매출액 16.4 21.7 23.1 28.6 (93.9)\n\n\n영업이익 -3.8 -2.7 1.9 6.5 (247.9)\n\n\n\n영업이익률 -22.8 -10.1 8.3 22.7\nSK 매출액 9.1 11.3 12.4 16.4\n하\n이 영업이익 -1.8 0.3 2.9 5.5\n닉\n스 영업이익률 -19.8 3.1 23.2 33.3\n\n\n\n매출액 9.1 11.3 12.4 16.4 (124.8)\n\n\n\n영업이익 -1.8 0.3 2.9 5.5 (289.8)\n\n\n\n영업이익률 -19.8 3.1 23.2 33.3\n\n\n\n자료: DRAMeXchange 주: 1) ( )내는 전년동기대비 증가율, 2) 반도체 부문 기준\n자료: 각사 홈페이지\n\n\n5) D램(DDR5 16GB) 및 낸드플래시(MLC 128GB) 고정거래가격($) :\n\n|Col1|23.9월말 12월말 24.3월말 24.4월말 5월말 6월말 7월말|\n|---|---|\n|D램<br>낸드플래시|3.32<br>3.90<br>4.10<br>4.65<br>4.65<br>4.65<br>4.65<br>3.82<br>4.10<br>4.90<br>4.90<br>4.90<br>4.90<br>4.90|\n\n\n\n6) D램(DDR5 16GB) 및 낸드플래시(MLC 128GB) 현물가격($) :\n\n|Col1|23.9월말 12월말 24.3월말 24.4월말 5월말 6월말 7월말|\n|---|---|\n|D램<br>낸드플래시|4.13<br>4.25<br>4.69<br>4.90<br>4.84<br>4.88<br>5.14<br>6.37<br>6.35<br>6.40<br>6.39<br>6.38<br>6.35<br>6.31|\n\n\n\n7) LPDDR(Low Power Double Data Rate)은 일반 D램보다 전력 소모가 적어 이동성이 강조되는 스마트폰 및 태플릿 등\n\n모바일 제품에 주로 사용되었으나, AI 산업 성장으로 저전력·고성능·고용량 메모리반도체의 필요성이 커지면서\nPC, 데이터센터 등으로 사용범위가 점차 확대되고 있다.\n8) 정형 데이터(언어)에 비해 비정형(이미지, 영상 등) 데이터가 차지하는 비중이 확대되는 가운데 개별기업들의 보안 등의 이슈\n\n로 자체 AI 구축 수요도 증가하면서 추론 서버를 자체적으로 구축(On-Premise)하기 위한 eSSD 사용이 점차 늘어나고 있다.\n9) 메모리반도체 업체들이 가동률을 높이는 가운데(삼성전자 70~80%, 키옥시아 100%, 웨스턴디지탈 90% 등) SK하이닉스도\n\n증산을 발표하였다.(한국반도체산업협회)\n10) 업계에 따르면, 삼성전자는 평택 반도체 4공장(P4)에 낸드플래시 라인을 구축하기로 결정하고, 7월 말까지 주요 설비를\n\n']","요약(근거: 한국은행, 2024년 2/4분기 주력산업 모니터링 보고서 — Ⅰ. 반도체)

주된 원인(우선순위 순)
1) 메모리반도체 수요 회복 및 고부가 AI용 제품 수요 확대
   - 메모리 수출이 전년동기대비 +93.6%로 수출 증가를 주도(보고서).  
   - HBM, LPDDR, eSSD 등 AI 서버·추론서버용 고용량·고가 제품 수요가 급증하면서 제품 믹스가 고가·고마진 쪽으로 이동했고, 이로 인해 업체들의 매출·이익이 큰 폭으로 증가(삼성전자 매출 +93.9%, SK하이닉스 +124.8% 등). (보고서 pp.5–6)

2) 수출가격(평균판매가격, 계약기준) 상승
   - 반도체 수출물가지수(계약가격기준)가 전년동기대비 약 +42.4% 상승, 전분기대비도 +9.9% 상승(보고서).  
   - 특히 D램의 고정거래·현물가격이 상승한 것이 수출금액 증가에 큰 영향을 미침(보고서 p.6).

3) 수출물량 증가
   - 같은 기간 반도체 수출물량은 전년동기대비 +14.8% (전분기대비 +4.6%)로 증가하여 금액 증가에 기여(보고서).

4) 생산·가동률 및 기업 전략
   - 메모리 업체들의 가동률 상승(예: 일부 업체 70~100%대 가동률)·증산 발표와 공장·라인 투자(예: 평택 P4 등)가 공급 확대와 출하로 연결(보고서).  
   - 다만 보고서는 반도체 생산의 증가세는 다소 축소되었다고 밝혀, 생산 증가보다 가격·제품 믹스 변화가 더 큰 역할을 했음을 시사.

5) 시스템반도체의 플러스 기여
   - 시스템반도체 수출도 전년동기대비 +13.1%로 플러스 기여했으나 규모는 메모리에 비해 작음(보고서).

정량적 관점(대략적 해석)
- 보고서 수치는 가격지수(+≈42%)와 물량(+≈15%)의 동시 상승이 반도체 수출액 급증의 핵심이라고 정리하고 있습니다. 메모리의 고성장(+93.6%)이 전체 수출 증가에서 가장 큰 역할을 했고, 시스템반도체·물량 증가·가동률 상승·재고(업스트림 재고 감소 등)·제품 믹스가 보조적으로 기여했습니다.

원문 출처
- 한국은행, 2024년 2/4분기 주력산업 모니터링 보고서 — Ⅰ. 반도체 (2024년 2분기) (보고서의 수치·설명 인용)

더 필요하신 자료
- 원하시면 가격·물량의 기여도를 수식(정밀 분해)으로 계산해 드리거나(보고서의 가격·물량 지수 수치 사용), 메모리·시스템별·업체별 세부 표(가격 추이, 가동률, 매출·이익 변동)를 정리해 드리겠습니다. 어느 쪽을 원하십니까?","2024년 2/4분기 반도체 수출 증가는 주로 메모리반도체 관련 요인들에 기인합니다. 보고서는 메모리반도체의 가격상승세가 지속되면서 메모리 부분이 (+93.6%)로 수출 증가를 주도했으며, 시스템반도체(+13.1%)의 증가도 함께 기여했다고 명시합니다. 요약하면 '메모리반도체 가격 상승'이 수출 증가의 핵심 동인이고, 여기에 '고부가가치 메모리반도체에 대한 견조한 수요'와 'IT 전방산업의 수요 회복'이 더해져 총수출을 크게 끌어올렸습니다.",0.3448275862068966,0.99999999995,0.6666666666666666,0.7723688365971683,0.4073952438233951
2024년 4/4분기 기준 디스플레이 생산의 전년동기대비 감소폭은 얼마였나?,"['[Document 1]\nMetadata: {\'has_images\': False, \'subject\': \'\', \'creator\': \'Hwp 2018 10.0.0.10640\', \'year\': 2024, \'file_path\': \'/workspaces/codespaces-jupyter/llmops_class/data/bok_major_industry_reports/2024_4사분기_주력산업_모니터링_보고서.pdf\', \'producer\': \'Hancom PDF 1.3.0.538\', \'title\': \'\', \'page_count\': 39, \'keywords\': \'\', \'modDate\': ""D:20250217103412+09\'00\'"", \'quarter\': 4, \'format\': \'PDF 1.4\', \'source\': \'2024_4사분기_주력산업_모니터링_보고서.pdf\', \'page\': 27, \'creationDate\': ""D:20250217103412+09\'00\'"", \'trapped\': \'\', \'author\': \'2010127\'}\nContent: 2024년 4/4분기 주력산업 모니터링 보고서(Ⅵ. 디스플레이)\n\n\n\n\n###### 최근 동향\n\n**1. 2024년 4/4분기 중 디스플레이 생산은 대형 LCD 패널 관련 구조조정이 계속되는**\n\n\n**가운데 전방산업의 수요가 둔화되면서 감소폭(전년동기대비 –6.7%)이 확대되었다.**\n\n\n국내 업체의 패널 내수출하, 수출출하는 모두\n디스플레이 생산은 감소폭이 확대\n감소폭이 확대\n\n\n[그림 6.1] 디스플레이 생산지수 [1)] [그림 6.2] 디스플레이 출하지수 [1)]\n\n\n\n주: 1) 전자 부품 제조업 기준\n자료: 통계청\n\n\n\n주: 1) 전자 부품 제조업 기준\n자료: 통계청\n\n\n\n72) LG디스플레이는 기존 LCD 생산 비중을 축소하는 한편 OLED 중심으로 사업 포트폴리오를 전환하고 있으며 2024년 4/4\n\n분기 중 OLED 제품의 매출 비중이 60%를 기록하며 역대 최고치를 달성하였다.(LG디스플레이 2024년 4/4분기 실적발표)\n73) 애플 신형 아이폰16 시리즈의 판매가 전작인 아이폰15 시리즈에 비해 부진하면서 2024년 10~11월 중 글로벌 스\n\n마트폰 판매량이 전년동기대비 5.1% 감소하였다.(Counterpoint)\n74) 스마트폰에 주로 탑재되는 중소형 OLED 패널 출하량 기준으로 중국 기업들의 시장점유율은 2023년 4/4분기 41.5%에서\n\n2024년 4/4분기 47.8%로 확대되었으나, 국내 기업(삼성디스플레이 및 LG디스플레이)은 같은 기간 57.2%에서 51.4%로\n하락하였다.(Omdia)\n\n\n                      - 23\n\n[Document 2]\nMetadata: {\'creator\': \'Hwp 2018 10.0.0.10640\', \'creationDate\': ""D:20250217103412+09\'00\'"", \'subject\': \'\', \'quarter\': 4, \'keywords\': \'\', \'title\': \'\', \'modDate\': ""D:20250217103412+09\'00\'"", \'file_path\': \'/workspaces/codespaces-jupyter/llmops_class/data/bok_major_industry_reports/2024_4사분기_주력산업_모니터링_보고서.pdf\', \'producer\': \'Hancom PDF 1.3.0.538\', \'source\': \'2024_4사분기_주력산업_모니터링_보고서.pdf\', \'page\': 27, \'page_count\': 39, \'format\': \'PDF 1.4\', \'year\': 2024, \'author\': \'2010127\', \'trapped\': \'\', \'has_images\': False}\nContent: 2024년 4/4분기 주력산업 모니터링 보고서(Ⅵ. 디스플레이)\n\n\n\n\n###### 최근 동향\n\n**1. 2024년 4/4분기 중 디스플레이 생산은 대형 LCD 패널 관련 구조조정이 계속되는**\n\n\n**가운데 전방산업의 수요가 둔화되면서 감소폭(전년동기대비 –6.7%)이 확대되었다.**\n\n\n국내 업체의 패널 내수출하, 수출출하는 모두\n디스플레이 생산은 감소폭이 확대\n감소폭이 확대\n\n\n[그림 6.1] 디스플레이 생산지수 [1)] [그림 6.2] 디스플레이 출하지수 [1)]\n\n\n\n주: 1) 전자 부품 제조업 기준\n자료: 통계청\n\n\n\n주: 1) 전자 부품 제조업 기준\n자료: 통계청\n\n\n\n72) LG디스플레이는 기존 LCD 생산 비중을 축소하는 한편 OLED 중심으로 사업 포트폴리오를 전환하고 있으며 2024년 4/4\n\n분기 중 OLED 제품의 매출 비중이 60%를 기록하며 역대 최고치를 달성하였다.(LG디스플레이 2024년 4/4분기 실적발표)\n73) 애플 신형 아이폰16 시리즈의 판매가 전작인 아이폰15 시리즈에 비해 부진하면서 2024년 10~11월 중 글로벌 스\n\n마트폰 판매량이 전년동기대비 5.1% 감소하였다.(Counterpoint)\n74) 스마트폰에 주로 탑재되는 중소형 OLED 패널 출하량 기준으로 중국 기업들의 시장점유율은 2023년 4/4분기 41.5%에서\n\n2024년 4/4분기 47.8%로 확대되었으나, 국내 기업(삼성디스플레이 및 LG디스플레이)은 같은 기간 57.2%에서 51.4%로\n하락하였다.(Omdia)\n\n\n                      - 23\n\n[Document 3]\nMetadata: {\'year\': 2024, \'creationDate\': ""D:20250217103412+09\'00\'"", \'title\': \'\', \'page_count\': 39, \'creator\': \'Hwp 2018 10.0.0.10640\', \'quarter\': 4, \'format\': \'PDF 1.4\', \'source\': \'2024_4사분기_주력산업_모니터링_보고서.pdf\', \'trapped\': \'\', \'keywords\': \'\', \'modDate\': ""D:20250217103412+09\'00\'"", \'has_images\': False, \'author\': \'2010127\', \'producer\': \'Hancom PDF 1.3.0.538\', \'page\': 27, \'subject\': \'\', \'file_path\': \'/workspaces/codespaces-jupyter/llmops_class/data/bok_major_industry_reports/2024_4사분기_주력산업_모니터링_보고서.pdf\'}\nContent: 2024년 4/4분기 주력산업 모니터링 보고서(Ⅵ. 디스플레이)\n\n\n\n\n###### 최근 동향\n\n**1. 2024년 4/4분기 중 디스플레이 생산은 대형 LCD 패널 관련 구조조정이 계속되는**\n\n\n**가운데 전방산업의 수요가 둔화되면서 감소폭(전년동기대비 –6.7%)이 확대되었다.**\n\n\n국내 업체의 패널 내수출하, 수출출하는 모두\n디스플레이 생산은 감소폭이 확대\n감소폭이 확대\n\n\n[그림 6.1] 디스플레이 생산지수 [1)] [그림 6.2] 디스플레이 출하지수 [1)]\n\n\n\n주: 1) 전자 부품 제조업 기준\n자료: 통계청\n\n\n\n주: 1) 전자 부품 제조업 기준\n자료: 통계청\n\n\n\n72) LG디스플레이는 기존 LCD 생산 비중을 축소하는 한편 OLED 중심으로 사업 포트폴리오를 전환하고 있으며 2024년 4/4\n\n분기 중 OLED 제품의 매출 비중이 60%를 기록하며 역대 최고치를 달성하였다.(LG디스플레이 2024년 4/4분기 실적발표)\n73) 애플 신형 아이폰16 시리즈의 판매가 전작인 아이폰15 시리즈에 비해 부진하면서 2024년 10~11월 중 글로벌 스\n\n마트폰 판매량이 전년동기대비 5.1% 감소하였다.(Counterpoint)\n74) 스마트폰에 주로 탑재되는 중소형 OLED 패널 출하량 기준으로 중국 기업들의 시장점유율은 2023년 4/4분기 41.5%에서\n\n2024년 4/4분기 47.8%로 확대되었으나, 국내 기업(삼성디스플레이 및 LG디스플레이)은 같은 기간 57.2%에서 51.4%로\n하락하였다.(Omdia)\n\n\n                      - 23\n\n[Document 4]\nMetadata: {\'subject\': \'\', \'title\': \'\', \'quarter\': 4, \'source\': \'2024_4사분기_주력산업_모니터링_보고서.pdf\', \'author\': \'2010127\', \'producer\': \'Hancom PDF 1.3.0.538\', \'trapped\': \'\', \'format\': \'PDF 1.4\', \'page\': 37, \'modDate\': ""D:20250217103412+09\'00\'"", \'creator\': \'Hwp 2018 10.0.0.10640\', \'has_images\': False, \'page_count\': 39, \'file_path\': \'/workspaces/codespaces-jupyter/llmops_class/data/bok_major_industry_reports/2024_4사분기_주력산업_모니터링_보고서.pdf\', \'year\': 2024, \'creationDate\': ""D:20250217103412+09\'00\'"", \'keywords\': \'\'}\nContent: 주: 1) ( )내는 전년동기대비 증가율\n자료: 한국무역통계진흥원\n\n\n\n**4. 국내 이차전지 및 양극재 생산 주요 기업의 영업실적은 전기차 시장의 캐즘 지속** **[89)]**\n\n\n**의 영향으로 부진이 이어졌다.**\n\n\n국내 주요 기업의 영업실적은 부진 지속\n\n[표 8.4] 국내 주요 기업 실적 [1)]\n\n\n(천억원, %)\n\n|Col1|LG에너지솔루션|삼성SDI|에코프로비엠|\n|---|---|---|---|\n|매출액<br>24.3/4분기<br>68.8<br> (-16.4)<br>39.4<br> (-29.8)<br> 5.2<br> (-71.1)<br>24.4/4분기<br>64.5<br> (-19.4)<br>37.6<br> (-32.4)<br> 5.2<br> (-56.3)<br>영업이익<br>24.3/4분기<br> 4.5<br> (-38.7)<br> 1.3<br> (-72.1)<br>-0.4<br>(-189.8)<br>24.4/4분기<br>-2.3<br>(-166.9)<br>-2.6<br>(-186.9)<br>-0.1<br> (-87.6)|매출액<br>24.3/4분기<br>68.8<br> (-16.4)<br>39.4<br> (-29.8)<br> 5.2<br> (-71.1)<br>24.4/4분기<br>64.5<br> (-19.4)<br>37.6<br> (-32.4)<br> 5.2<br> (-56.3)<br>영업이익<br>24.3/4분기<br> 4.5<br> (-38.7)<br> 1.3<br> (-72.1)<br>-0.4<br>(-189.8)<br>24.4/4분기<br>-2.3<br>(-166.9)<br>-2.6<br>(-186.9)<br>-0.1<br> (-87.6)|매출액<br>24.3/4분기<br>68.8<br> (-16.4)<br>39.4<br> (-29.8)<br> 5.2<br> (-71.1)<br>24.4/4분기<br>64.5<br> (-19.4)<br>37.6<br> (-32.4)<br> 5.2<br> (-56.3)<br>영업이익<br>24.3/4분기<br> 4.5<br> (-38.7)<br> 1.3<br> (-72.1)<br>-0.4<br>(-189.8)<br>24.4/4분기<br>-2.3<br>(-166.9)<br>-2.6<br>(-186.9)<br>-0.1<br> (-87.6)|매출액<br>24.3/4분기<br>68.8<br> (-16.4)<br>39.4<br> (-29.8)<br> 5.2<br> (-71.1)<br>24.4/4분기<br>64.5<br> (-19.4)<br>37.6<br> (-32.4)<br> 5.2<br> (-56.3)<br>영업이익<br>24.3/4분기<br> 4.5<br> (-38.7)<br> 1.3<br> (-72.1)<br>-0.4<br>(-189.8)<br>24.4/4분기<br>-2.3<br>(-166.9)<br>-2.6<br>(-186.9)<br>-0.1<br> (-87.6)|\n\n\n\n주: 1) ( )내는 전년동기대비 증가율\n\n자료: 각사 발표\n\n\n89) 전기차 시장의 캐즘(Chasm, 일시적 수요 정체)이 지속되는 이유는 충전시설 등의 인프라가 부족하고 가격대가 내연\n\n기관보다 높게 형성되어 있기 때문이다. 이외에도 2024년 초 북미지역 한파에 따른 배터리 성능 하락 현상, 전기차\n화재로 인한 불안감 등이 전기차 수요 회복에 부정적 영향을 미치고 있다.\n\n\n                      - 33\n\n']","2024년 4/4분기 기준 디스플레이 생산은 전년동기대비 –6.7% 감소했습니다. (출처: 한국은행, 2024년 4사분기 주력산업 모니터링 보고서, Ⅵ. 디스플레이)","2024년 4/4분기 기준 디스플레이 생산은 전년동기대비 -6.7%로 감소하였다. 이러한 감소폭 확대는 대형 LCD 패널 관련 구조조정이 지속되는 가운데 전방산업의 수요 둔화, 국내 업체의 LCD 패널 생산 비중 축소, 주요 고객사의 신형 스마트폰 판매 부진 및 중국 기업과의 경쟁 심화 등의 영향으로 설명된다.",0.75,0.9999999999,0.5,0.7428196169498115,0.3473070914994204
"2024년 4분기 기준, 반도체 수출은 어떤 제품 중심으로 양호한 흐름을 이어갈 것으로 보고서에서 전망하고 있는가?","['[Document 1]\nMetadata: {\'source\': \'2024_4사분기_주력산업_모니터링_보고서.pdf\', \'file_path\': \'/workspaces/codespaces-jupyter/llmops_class/data/bok_major_industry_reports/2024_4사분기_주력산업_모니터링_보고서.pdf\', \'format\': \'PDF 1.4\', \'quarter\': 4, \'has_images\': False, \'subject\': \'\', \'title\': \'\', \'author\': \'2010127\', \'page\': 7, \'keywords\': \'\', \'creator\': \'Hwp 2018 10.0.0.10640\', \'modDate\': ""D:20250217103412+09\'00\'"", \'trapped\': \'\', \'creationDate\': ""D:20250217103412+09\'00\'"", \'producer\': \'Hancom PDF 1.3.0.538\', \'year\': 2024, \'page_count\': 39}\nContent: 2024년 4/4분기 주력산업 모니터링 보고서(Ⅰ. 반도체)\n\n###### 향후 전망\n\n\n**4. 2025년 1/4분기 중 반도체 수출은 고성능 반도체 수출 호조에도 불구하고 범용 반도**\n\n\n**체 수요 부진, 기저효과** **[11)]** **등에 따라 둔화세가 이어질 전망이다.** **[12)]**\n\n\n**5. 메모리반도체는 견조한 AI 투자 수요로 고성능 반도체의 양호한 성장세가 이어지겠으**\n\n\n**나, 메모리반도체 가격 하락 등에 따라 전반적으로 성장 흐름은 약화될 것으로 보인다.**\n\n\n낸드플래시 초과공급 지속 HBM을 제외한 D램의 가격 하락세가 확대될 전망\n\n\n[그림 1.4] 메모리 반도체 수급 전망 [표 1.2] 주요 D램 가격 등락률 [1)] 전망\n\n\n\n25\n\n\n20\n\n\n15\n\n\n10\n\n\n5\n\n\n0\n\n\n-5\n\n\n-10\n\n\n-15\n\n\n\n25\n\n\n20\n\n\n15\n\n\n10\n\n\n5\n\n\n0\n\n\n-5\n\n\n-10\n\n\n-15\n\n\n\n(%)                              (%)\n\n\n\ne e\n\n\n\n|분 류|Col2|‘24.4분기p|‘25.1분기e|\n|---|---|---|---|\n|PC용|DDR4<br>DDR5|-8~13%<br>-3~8%|-10~15%<br>-5~10%|\n|서버용|DDR4<br>DDR5<br>|-8~13%<br>+3~8%<br>|-10~15%<br>-3~8%<br>|\n|모바일용|LPDDR4X<br>LPDDR5X|-13~18%<br>-5~10%|–8~13%<br>-3~8%|\n|전체<br>(HBM 포함시)|전체<br>(HBM 포함시)|-3~8%<br>(+0~8%)|-8~13%<br>(-0~5%)|\n\n\n주: 1) 전분기 대비\n자료: Trendforce(24.12월)\n\n\n\n22.1/4 3/4 23.1/4 3/4 24.1/4 3/4 25.1/4 3/4\n\n\n\n주: 1) 점선은 전망치\n자료: Gartner(24.12월)\n\n\n\n11) 2024년 1/4분기 반도체 수출은 전년동기대비 50.7% 증가하면서 사상 최고 수준의 수출증가율을 기록하였다.\n12) 2024년 하반기부터 이어진 PC, 스마트폰 등 IT기기 판매 부진으로 인해 IT 전방 기업들의 재고조정이 진행중이며, 이\n\n러한 추세는 2025년 상반기까지 지속될 것으로 예상된다.(SK증권, 유진투자증권) 다만, 중국 정부의 이구환신 정책\n추진 가속화에 따른 중국 모바일제품 수요 회복, 세트 업계의 부품 소진 기간 단축 등은 범용 메모리반도체 수요 회\n복의 상방요인으로 작용할 수 있다.(삼성증권)\n13) HBM은 세대를 거듭할수록 웨이퍼 Capa 잠식 효과가 커지는데, 과거 범용 반도체 대비 1:2.5~3 수준이었던 HBM 웨이퍼 소\n\n요량이 HBM4에서는 1:3 이상으로 확대될 것으로 보인다. 2025년 하반기 HBM4 출시를 위한 준비가 2025년 2분기부터 본\n격화될 것으로 예상된다.(삼성증권)\n14) 2024년 전 세계 데이터센터 투자는 전년 대비 34.7% 증가하여 468조원을 기록했으며, 2025년에는 15.5% 증가한 536조\n\n원에 이를 것으로 예상된다. 미국 빅테크 기업들이 대규모 AI 데이터센터 투자 계획을 발표했는데, 아마존은 미국 오하\n이오주 데이터센터 확장에 100억달러 투자를 결정한 데 이어 조지아주에도 110억달러를 투자할 계획이다. 마이크로소\n프트도 올해 6월까지 AI 데이터센터 건설에 116조원을 투입한다는 계획을 발표했다.(Gartner, 미래에셋증권)\n15) 2024년 클라우드 서비스 제공업체(CSP)들이 엔비디아의 그래픽처리장치(GPU) 호퍼를 대량 구매하면서 AI 서버 출하량\n\n이 전년 대비 46% 성장했다. AI 서버 출하량은 2025년에도 28% 증가하는 등 성장세를 이어가면서 시장규모가 433억\n에 이를 것으로 예상된다.(Trendforce)\n16) 업계에 따르면 블랙웰 칩에 과열 등 결함이 발생하여 엔비디아의 주요 고객사인 마이크로소프트, 아마존, 구글, 메타\n\n등이 블랙웰 주문을 연기하거나 이전 세대 AI 칩을 요구하고 있는 것으로 알려졌다.\n\n\n                       - 3\n\n[Document 2]\nMetadata: {\'has_images\': False, \'page\': 7, \'creationDate\': ""D:20250217103412+09\'00\'"", \'modDate\': ""D:20250217103412+09\'00\'"", \'keywords\': \'\', \'producer\': \'Hancom PDF 1.3.0.538\', \'source\': \'2024_4사분기_주력산업_모니터링_보고서.pdf\', \'format\': \'PDF 1.4\', \'quarter\': 4, \'page_count\': 39, \'trapped\': \'\', \'subject\': \'\', \'creator\': \'Hwp 2018 10.0.0.10640\', \'year\': 2024, \'file_path\': \'/workspaces/codespaces-jupyter/llmops_class/data/bok_major_industry_reports/2024_4사분기_주력산업_모니터링_보고서.pdf\', \'author\': \'2010127\', \'title\': \'\'}\nContent: 2024년 4/4분기 주력산업 모니터링 보고서(Ⅰ. 반도체)\n\n###### 향후 전망\n\n\n**4. 2025년 1/4분기 중 반도체 수출은 고성능 반도체 수출 호조에도 불구하고 범용 반도**\n\n\n**체 수요 부진, 기저효과** **[11)]** **등에 따라 둔화세가 이어질 전망이다.** **[12)]**\n\n\n**5. 메모리반도체는 견조한 AI 투자 수요로 고성능 반도체의 양호한 성장세가 이어지겠으**\n\n\n**나, 메모리반도체 가격 하락 등에 따라 전반적으로 성장 흐름은 약화될 것으로 보인다.**\n\n\n낸드플래시 초과공급 지속 HBM을 제외한 D램의 가격 하락세가 확대될 전망\n\n\n[그림 1.4] 메모리 반도체 수급 전망 [표 1.2] 주요 D램 가격 등락률 [1)] 전망\n\n\n\n25\n\n\n20\n\n\n15\n\n\n10\n\n\n5\n\n\n0\n\n\n-5\n\n\n-10\n\n\n-15\n\n\n\n25\n\n\n20\n\n\n15\n\n\n10\n\n\n5\n\n\n0\n\n\n-5\n\n\n-10\n\n\n-15\n\n\n\n(%)                              (%)\n\n\n\ne e\n\n\n\n|분 류|Col2|‘24.4분기p|‘25.1분기e|\n|---|---|---|---|\n|PC용|DDR4<br>DDR5|-8~13%<br>-3~8%|-10~15%<br>-5~10%|\n|서버용|DDR4<br>DDR5<br>|-8~13%<br>+3~8%<br>|-10~15%<br>-3~8%<br>|\n|모바일용|LPDDR4X<br>LPDDR5X|-13~18%<br>-5~10%|–8~13%<br>-3~8%|\n|전체<br>(HBM 포함시)|전체<br>(HBM 포함시)|-3~8%<br>(+0~8%)|-8~13%<br>(-0~5%)|\n\n\n주: 1) 전분기 대비\n자료: Trendforce(24.12월)\n\n\n\n22.1/4 3/4 23.1/4 3/4 24.1/4 3/4 25.1/4 3/4\n\n\n\n주: 1) 점선은 전망치\n자료: Gartner(24.12월)\n\n\n\n11) 2024년 1/4분기 반도체 수출은 전년동기대비 50.7% 증가하면서 사상 최고 수준의 수출증가율을 기록하였다.\n12) 2024년 하반기부터 이어진 PC, 스마트폰 등 IT기기 판매 부진으로 인해 IT 전방 기업들의 재고조정이 진행중이며, 이\n\n러한 추세는 2025년 상반기까지 지속될 것으로 예상된다.(SK증권, 유진투자증권) 다만, 중국 정부의 이구환신 정책\n추진 가속화에 따른 중국 모바일제품 수요 회복, 세트 업계의 부품 소진 기간 단축 등은 범용 메모리반도체 수요 회\n복의 상방요인으로 작용할 수 있다.(삼성증권)\n13) HBM은 세대를 거듭할수록 웨이퍼 Capa 잠식 효과가 커지는데, 과거 범용 반도체 대비 1:2.5~3 수준이었던 HBM 웨이퍼 소\n\n요량이 HBM4에서는 1:3 이상으로 확대될 것으로 보인다. 2025년 하반기 HBM4 출시를 위한 준비가 2025년 2분기부터 본\n격화될 것으로 예상된다.(삼성증권)\n14) 2024년 전 세계 데이터센터 투자는 전년 대비 34.7% 증가하여 468조원을 기록했으며, 2025년에는 15.5% 증가한 536조\n\n원에 이를 것으로 예상된다. 미국 빅테크 기업들이 대규모 AI 데이터센터 투자 계획을 발표했는데, 아마존은 미국 오하\n이오주 데이터센터 확장에 100억달러 투자를 결정한 데 이어 조지아주에도 110억달러를 투자할 계획이다. 마이크로소\n프트도 올해 6월까지 AI 데이터센터 건설에 116조원을 투입한다는 계획을 발표했다.(Gartner, 미래에셋증권)\n15) 2024년 클라우드 서비스 제공업체(CSP)들이 엔비디아의 그래픽처리장치(GPU) 호퍼를 대량 구매하면서 AI 서버 출하량\n\n이 전년 대비 46% 성장했다. AI 서버 출하량은 2025년에도 28% 증가하는 등 성장세를 이어가면서 시장규모가 433억\n에 이를 것으로 예상된다.(Trendforce)\n16) 업계에 따르면 블랙웰 칩에 과열 등 결함이 발생하여 엔비디아의 주요 고객사인 마이크로소프트, 아마존, 구글, 메타\n\n등이 블랙웰 주문을 연기하거나 이전 세대 AI 칩을 요구하고 있는 것으로 알려졌다.\n\n\n                       - 3\n\n[Document 3]\nMetadata: {\'subject\': \'\', \'author\': \'2010127\', \'trapped\': \'\', \'creationDate\': ""D:20250217103412+09\'00\'"", \'page_count\': 39, \'keywords\': \'\', \'modDate\': ""D:20250217103412+09\'00\'"", \'title\': \'\', \'has_images\': False, \'quarter\': 4, \'file_path\': \'/workspaces/codespaces-jupyter/llmops_class/data/bok_major_industry_reports/2024_4사분기_주력산업_모니터링_보고서.pdf\', \'producer\': \'Hancom PDF 1.3.0.538\', \'source\': \'2024_4사분기_주력산업_모니터링_보고서.pdf\', \'creator\': \'Hwp 2018 10.0.0.10640\', \'year\': 2024, \'page\': 7, \'format\': \'PDF 1.4\'}\nContent: 2024년 4/4분기 주력산업 모니터링 보고서(Ⅰ. 반도체)\n\n###### 향후 전망\n\n\n**4. 2025년 1/4분기 중 반도체 수출은 고성능 반도체 수출 호조에도 불구하고 범용 반도**\n\n\n**체 수요 부진, 기저효과** **[11)]** **등에 따라 둔화세가 이어질 전망이다.** **[12)]**\n\n\n**5. 메모리반도체는 견조한 AI 투자 수요로 고성능 반도체의 양호한 성장세가 이어지겠으**\n\n\n**나, 메모리반도체 가격 하락 등에 따라 전반적으로 성장 흐름은 약화될 것으로 보인다.**\n\n\n낸드플래시 초과공급 지속 HBM을 제외한 D램의 가격 하락세가 확대될 전망\n\n\n[그림 1.4] 메모리 반도체 수급 전망 [표 1.2] 주요 D램 가격 등락률 [1)] 전망\n\n\n\n25\n\n\n20\n\n\n15\n\n\n10\n\n\n5\n\n\n0\n\n\n-5\n\n\n-10\n\n\n-15\n\n\n\n25\n\n\n20\n\n\n15\n\n\n10\n\n\n5\n\n\n0\n\n\n-5\n\n\n-10\n\n\n-15\n\n\n\n(%)                              (%)\n\n\n\ne e\n\n\n\n|분 류|Col2|‘24.4분기p|‘25.1분기e|\n|---|---|---|---|\n|PC용|DDR4<br>DDR5|-8~13%<br>-3~8%|-10~15%<br>-5~10%|\n|서버용|DDR4<br>DDR5<br>|-8~13%<br>+3~8%<br>|-10~15%<br>-3~8%<br>|\n|모바일용|LPDDR4X<br>LPDDR5X|-13~18%<br>-5~10%|–8~13%<br>-3~8%|\n|전체<br>(HBM 포함시)|전체<br>(HBM 포함시)|-3~8%<br>(+0~8%)|-8~13%<br>(-0~5%)|\n\n\n주: 1) 전분기 대비\n자료: Trendforce(24.12월)\n\n\n\n22.1/4 3/4 23.1/4 3/4 24.1/4 3/4 25.1/4 3/4\n\n\n\n주: 1) 점선은 전망치\n자료: Gartner(24.12월)\n\n\n\n11) 2024년 1/4분기 반도체 수출은 전년동기대비 50.7% 증가하면서 사상 최고 수준의 수출증가율을 기록하였다.\n12) 2024년 하반기부터 이어진 PC, 스마트폰 등 IT기기 판매 부진으로 인해 IT 전방 기업들의 재고조정이 진행중이며, 이\n\n러한 추세는 2025년 상반기까지 지속될 것으로 예상된다.(SK증권, 유진투자증권) 다만, 중국 정부의 이구환신 정책\n추진 가속화에 따른 중국 모바일제품 수요 회복, 세트 업계의 부품 소진 기간 단축 등은 범용 메모리반도체 수요 회\n복의 상방요인으로 작용할 수 있다.(삼성증권)\n13) HBM은 세대를 거듭할수록 웨이퍼 Capa 잠식 효과가 커지는데, 과거 범용 반도체 대비 1:2.5~3 수준이었던 HBM 웨이퍼 소\n\n요량이 HBM4에서는 1:3 이상으로 확대될 것으로 보인다. 2025년 하반기 HBM4 출시를 위한 준비가 2025년 2분기부터 본\n격화될 것으로 예상된다.(삼성증권)\n14) 2024년 전 세계 데이터센터 투자는 전년 대비 34.7% 증가하여 468조원을 기록했으며, 2025년에는 15.5% 증가한 536조\n\n원에 이를 것으로 예상된다. 미국 빅테크 기업들이 대규모 AI 데이터센터 투자 계획을 발표했는데, 아마존은 미국 오하\n이오주 데이터센터 확장에 100억달러 투자를 결정한 데 이어 조지아주에도 110억달러를 투자할 계획이다. 마이크로소\n프트도 올해 6월까지 AI 데이터센터 건설에 116조원을 투입한다는 계획을 발표했다.(Gartner, 미래에셋증권)\n15) 2024년 클라우드 서비스 제공업체(CSP)들이 엔비디아의 그래픽처리장치(GPU) 호퍼를 대량 구매하면서 AI 서버 출하량\n\n이 전년 대비 46% 성장했다. AI 서버 출하량은 2025년에도 28% 증가하는 등 성장세를 이어가면서 시장규모가 433억\n에 이를 것으로 예상된다.(Trendforce)\n16) 업계에 따르면 블랙웰 칩에 과열 등 결함이 발생하여 엔비디아의 주요 고객사인 마이크로소프트, 아마존, 구글, 메타\n\n등이 블랙웰 주문을 연기하거나 이전 세대 AI 칩을 요구하고 있는 것으로 알려졌다.\n\n\n                       - 3\n\n[Document 4]\nMetadata: {\'author\': \'2010127\', \'creationDate\': ""D:20250217103412+09\'00\'"", \'keywords\': \'\', \'has_images\': False, \'quarter\': 4, \'subject\': \'\', \'page_count\': 39, \'file_path\': \'/workspaces/codespaces-jupyter/llmops_class/data/bok_major_industry_reports/2024_4사분기_주력산업_모니터링_보고서.pdf\', \'modDate\': ""D:20250217103412+09\'00\'"", \'title\': \'\', \'year\': 2024, \'trapped\': \'\', \'page\': 5, \'producer\': \'Hancom PDF 1.3.0.538\', \'format\': \'PDF 1.4\', \'creator\': \'Hwp 2018 10.0.0.10640\', \'source\': \'2024_4사분기_주력산업_모니터링_보고서.pdf\'}\nContent: 2024년 4/4분기 주력산업 모니터링 보고서(Ⅰ. 반도체)\n\n\n\n\n\n**1. 2024년 4/4분기 중 반도체 수출은 전년동기대비 34.0% 증가하면서 증가세(전분기 +41.4%)가**\n\n\n**전분기에 이어 축소되었다.**\n\n\n반도체 수출은 전분기에 이어 증가세가 축소 반도체 생산은 전분기대비 증가세가 확대\n\n\n[그림 1.1] 반도체 수출 [그림 1.2] 반도체 생산\n\n\n자료: 한국무역통계진흥원 자료: 한국은행, 통계청\n\n\n1) 2024.4/4분기 중 메모리반도체 수출물량은 전분기대비 0.7% 감소(전년동기대비 -16.4%)하였다.(한국무역통계진흥원)\n2) 2024.4/4분기 중 반도체 수출물가지수(계약가격기준)는 전분기대비 6.2% 하락(전년동기대비 +25.1%)하였다.\n3) 메모리반도체 수출증가율은 전분기(24.3/4분기) 71.8%에서 50.4%로 축소된 반면, 시스템반도체의 경우 전분기 6.5%에서\n\n9.8%로 확대되었다.\n4) 2024년 9월 반도체 생산이 일시적으로 감소(전년동기대비 기준)한 데 따른 영향이다.\n\n\n                       - 1\n\n']","보고서는 2024년 4분기 기준 반도체 수출이 고성능 반도체 중심으로 양호한 흐름을 이어갈 것으로 전망하고 있습니다. 구체적으로 AI 투자 수요에 힘입은 고성능 메모리(HBM 등) 및 고성능(시스템) 반도체 수요가 호조를 보일 것으로 보인다고 밝히고 있습니다(문서 1, 2024년 4분기 주력산업 모니터링 보고서, pp.7 / 문서 4, p.5).","보고서는 2024년 4분기 중 반도체 수출이 AI 반도체를 중심으로 양호한 흐름을 이어갈 것으로 전망하고 있으며, 다만 PC·모바일 등 IT 전방수요 회복 속도의 불확실성이 존재한다고 설명한다. 또한 수요가 많은 고성능 제품(HBM, QLC SSD 등) 생산에 주력할 것으로 예상된다고 덧붙이고 있다.",0.5,0.9999999999,0.0,0.7537427426469705,0.5603335009450588
2024년 2/4분기 기준 반도체의 수출증가율(전년동기대비)은 얼마이며 그 배경은 무엇인가?,"['[Document 1]\nMetadata: {\'trapped\': \'\', \'creationDate\': ""D:20240809153829+09\'00\'"", \'format\': \'PDF 1.4\', \'file_path\': \'/workspaces/codespaces-jupyter/llmops_class/data/bok_major_industry_reports/2024_2사분기_주력산업_모니터링_보고서.pdf\', \'keywords\': \'\', \'title\': \'\', \'year\': 2024, \'producer\': \'Hancom PDF 1.3.0.538\', \'has_images\': False, \'modDate\': ""D:20240809153829+09\'00\'"", \'quarter\': 2, \'creator\': \'Hwp 2018 10.0.0.10640\', \'subject\': \'\', \'author\': \'0510190\', \'source\': \'2024_2사분기_주력산업_모니터링_보고서.pdf\', \'page\': 5, \'page_count\': 38}\nContent: 2024년 2/4분기 주력산업 모니터링 보고서(Ⅰ. 반도체)\n\n#### <산업별 모니터링 결과><산업별 모니터링 결과>\n\n\n\n\n\n**1. 2024년 2/4분기 중 반도체 수출은 전년동기대비 53.5% 증가하면서 증가세(전분기 +50.7%)가**\n\n\n**확대되었다. 메모리반도체(+93.6%)가 수출 증가를 주도한 가운데,** **시스템반도체(+13.1%)**\n\n\n**의 증가도 가세하였다.**\n\n\n반도체 수출 호조 지속 반도체 생산은 증가세 축소\n\n\n[그림 1.1] 반도체 수출 [그림 1.2] 반도체 생산\n\n\n자료: 한국무역통계진흥원 자료: 한국은행, 통계청\n\n\n1) AI 반도체 시장 전망(십억불, Gartner) : (2022) 42.2 →(2023) 53.7 →(2024 [e] ) 84.3 →(2025 [e] ) 114.0 →(2026 [e] ) 144.2 →(2027 [e] ) 173.9\n2) 2024.2/4분기 중 반도체 수출물가지수(계약가격기준)는 전분기대비 9.9% 상승(전년동기대비 +42.4%)하였다.\n3) 2024.2/4분기 중 반도체 수출물량은 전분기대비 4.6% 증가(전년동기대비 +14.8%)하였다.(한국무역통계진흥원)\n4) 경기지역 전자･영상･음향･통신 부문 재고 증감율 : (2월) -13.4% →(3월) -16.7% →(4월 [p] ) -28.8% →(5월 [p] ) -28.8%\n\n\n                       - 1\n\n[Document 2]\nMetadata: {\'author\': \'0510190\', \'creator\': \'Hwp 2018 10.0.0.10640\', \'producer\': \'Hancom PDF 1.3.0.538\', \'page\': 5, \'has_images\': False, \'creationDate\': ""D:20240809153829+09\'00\'"", \'trapped\': \'\', \'year\': 2024, \'format\': \'PDF 1.4\', \'title\': \'\', \'subject\': \'\', \'modDate\': ""D:20240809153829+09\'00\'"", \'page_count\': 38, \'file_path\': \'/workspaces/codespaces-jupyter/llmops_class/data/bok_major_industry_reports/2024_2사분기_주력산업_모니터링_보고서.pdf\', \'source\': \'2024_2사분기_주력산업_모니터링_보고서.pdf\', \'keywords\': \'\', \'quarter\': 2}\nContent: 2024년 2/4분기 주력산업 모니터링 보고서(Ⅰ. 반도체)\n\n#### <산업별 모니터링 결과><산업별 모니터링 결과>\n\n\n\n\n\n**1. 2024년 2/4분기 중 반도체 수출은 전년동기대비 53.5% 증가하면서 증가세(전분기 +50.7%)가**\n\n\n**확대되었다. 메모리반도체(+93.6%)가 수출 증가를 주도한 가운데,** **시스템반도체(+13.1%)**\n\n\n**의 증가도 가세하였다.**\n\n\n반도체 수출 호조 지속 반도체 생산은 증가세 축소\n\n\n[그림 1.1] 반도체 수출 [그림 1.2] 반도체 생산\n\n\n자료: 한국무역통계진흥원 자료: 한국은행, 통계청\n\n\n1) AI 반도체 시장 전망(십억불, Gartner) : (2022) 42.2 →(2023) 53.7 →(2024 [e] ) 84.3 →(2025 [e] ) 114.0 →(2026 [e] ) 144.2 →(2027 [e] ) 173.9\n2) 2024.2/4분기 중 반도체 수출물가지수(계약가격기준)는 전분기대비 9.9% 상승(전년동기대비 +42.4%)하였다.\n3) 2024.2/4분기 중 반도체 수출물량은 전분기대비 4.6% 증가(전년동기대비 +14.8%)하였다.(한국무역통계진흥원)\n4) 경기지역 전자･영상･음향･통신 부문 재고 증감율 : (2월) -13.4% →(3월) -16.7% →(4월 [p] ) -28.8% →(5월 [p] ) -28.8%\n\n\n                       - 1\n\n[Document 3]\nMetadata: {\'modDate\': ""D:20240809153829+09\'00\'"", \'author\': \'0510190\', \'quarter\': 2, \'has_images\': False, \'year\': 2024, \'keywords\': \'\', \'title\': \'\', \'page\': 5, \'producer\': \'Hancom PDF 1.3.0.538\', \'creator\': \'Hwp 2018 10.0.0.10640\', \'creationDate\': ""D:20240809153829+09\'00\'"", \'subject\': \'\', \'trapped\': \'\', \'file_path\': \'/workspaces/codespaces-jupyter/llmops_class/data/bok_major_industry_reports/2024_2사분기_주력산업_모니터링_보고서.pdf\', \'format\': \'PDF 1.4\', \'source\': \'2024_2사분기_주력산업_모니터링_보고서.pdf\', \'page_count\': 38}\nContent: 2024년 2/4분기 주력산업 모니터링 보고서(Ⅰ. 반도체)\n\n#### <산업별 모니터링 결과><산업별 모니터링 결과>\n\n\n\n\n\n**1. 2024년 2/4분기 중 반도체 수출은 전년동기대비 53.5% 증가하면서 증가세(전분기 +50.7%)가**\n\n\n**확대되었다. 메모리반도체(+93.6%)가 수출 증가를 주도한 가운데,** **시스템반도체(+13.1%)**\n\n\n**의 증가도 가세하였다.**\n\n\n반도체 수출 호조 지속 반도체 생산은 증가세 축소\n\n\n[그림 1.1] 반도체 수출 [그림 1.2] 반도체 생산\n\n\n자료: 한국무역통계진흥원 자료: 한국은행, 통계청\n\n\n1) AI 반도체 시장 전망(십억불, Gartner) : (2022) 42.2 →(2023) 53.7 →(2024 [e] ) 84.3 →(2025 [e] ) 114.0 →(2026 [e] ) 144.2 →(2027 [e] ) 173.9\n2) 2024.2/4분기 중 반도체 수출물가지수(계약가격기준)는 전분기대비 9.9% 상승(전년동기대비 +42.4%)하였다.\n3) 2024.2/4분기 중 반도체 수출물량은 전분기대비 4.6% 증가(전년동기대비 +14.8%)하였다.(한국무역통계진흥원)\n4) 경기지역 전자･영상･음향･통신 부문 재고 증감율 : (2월) -13.4% →(3월) -16.7% →(4월 [p] ) -28.8% →(5월 [p] ) -28.8%\n\n\n                       - 1\n\n[Document 4]\nMetadata: {\'subject\': \'\', \'year\': 2024, \'producer\': \'Hancom PDF 1.3.0.538\', \'keywords\': \'\', \'trapped\': \'\', \'title\': \'\', \'author\': \'0510190\', \'creationDate\': ""D:20240809153829+09\'00\'"", \'file_path\': \'/workspaces/codespaces-jupyter/llmops_class/data/bok_major_industry_reports/2024_2사분기_주력산업_모니터링_보고서.pdf\', \'has_images\': False, \'quarter\': 2, \'format\': \'PDF 1.4\', \'modDate\': ""D:20240809153829+09\'00\'"", \'page_count\': 38, \'creator\': \'Hwp 2018 10.0.0.10640\', \'page\': 30, \'source\': \'2024_2사분기_주력산업_모니터링_보고서.pdf\'}\nContent: 2024년 2/4분기 주력산업 모니터링 보고서(Ⅶ. 휴대폰)\n\n\n\n\n###### 최근 동향\n\n**1. 2024.2/4분기 중 휴대폰 및 부품 수출은 완제품이 10.5% 감소한 반면 부품은**\n\n\n**23.9% 늘어나 전년동기대비 12.0% 증가하였다.**\n\n\n휴대폰 및 부품 수출은 전년동기대비 12.0% 증가 완제품 수출은 감소하였으나 부품 수출은 증가\n\n\n[그림 7.1] 휴대폰 및 부품 수출 [표 7.1] 2024.2/4분기 휴대폰 및 부품 수출\n\n\n(단위: 억달러, 전년동기대비, %)\n\n|Col1|완제품|Col3|부품|Col5|\n|---|---|---|---|---|\n||**금액**|**증가율**|**금액**|**증가율**|\n|미 국<br>0.10<br>(-96.6)<br>0.42<br>(39.7)<br>E  U1)<br>4.97<br>(-4.0)<br>0.71<br>(16.4)<br>중 국2)<br>0.33<br>(5.2)<br>11.57<br>(20.0)<br>베트남<br>0.05<br>(21.1)<br>5.51<br>(15.8)<br>인 도<br>0.01<br>(-38.8)<br>0.65<br>(5.7)<br>전 체<br>7.96<br>(-10.5)<br>20.81<br>(23.9)|미 국<br>0.10<br>(-96.6)<br>0.42<br>(39.7)<br>E  U1)<br>4.97<br>(-4.0)<br>0.71<br>(16.4)<br>중 국2)<br>0.33<br>(5.2)<br>11.57<br>(20.0)<br>베트남<br>0.05<br>(21.1)<br>5.51<br>(15.8)<br>인 도<br>0.01<br>(-38.8)<br>0.65<br>(5.7)<br>전 체<br>7.96<br>(-10.5)<br>20.81<br>(23.9)|미 국<br>0.10<br>(-96.6)<br>0.42<br>(39.7)<br>E  U1)<br>4.97<br>(-4.0)<br>0.71<br>(16.4)<br>중 국2)<br>0.33<br>(5.2)<br>11.57<br>(20.0)<br>베트남<br>0.05<br>(21.1)<br>5.51<br>(15.8)<br>인 도<br>0.01<br>(-38.8)<br>0.65<br>(5.7)<br>전 체<br>7.96<br>(-10.5)<br>20.81<br>(23.9)|미 국<br>0.10<br>(-96.6)<br>0.42<br>(39.7)<br>E  U1)<br>4.97<br>(-4.0)<br>0.71<br>(16.4)<br>중 국2)<br>0.33<br>(5.2)<br>11.57<br>(20.0)<br>베트남<br>0.05<br>(21.1)<br>5.51<br>(15.8)<br>인 도<br>0.01<br>(-38.8)<br>0.65<br>(5.7)<br>전 체<br>7.96<br>(-10.5)<br>20.81<br>(23.9)|미 국<br>0.10<br>(-96.6)<br>0.42<br>(39.7)<br>E  U1)<br>4.97<br>(-4.0)<br>0.71<br>(16.4)<br>중 국2)<br>0.33<br>(5.2)<br>11.57<br>(20.0)<br>베트남<br>0.05<br>(21.1)<br>5.51<br>(15.8)<br>인 도<br>0.01<br>(-38.8)<br>0.65<br>(5.7)<br>전 체<br>7.96<br>(-10.5)<br>20.81<br>(23.9)|\n\n\n\n자료: 한국무역통계진흥원 주: 1) 영국 포함,  2) 홍콩, 마카오 포함\n자료: 한국무역통계진흥원\n\n\n88) 최근 삼성전자 등 글로벌 기업은 글로벌 통상 여건 변화에 대응하여 세계 각지에 분포한 생산기지의 생산물량을 유\n\n']","요약 답변
- 수출증가율(전년동기대비): 53.5% 증가(2024년 2/4분기).  
- 주요 배경:
  1. 품목별로는 메모리반도체가 수출 증가를 주도(메모리 +93.6%), 시스템반도체도 증가(+13.1%).  
  2. 수출단가(계약가격 기준)가 크게 상승하여 수출액을 끌어올림(수출물가지수 전년동기대비 +42.4%; 전분기대비 +9.9%).  
  3. 물량도 늘어남(수출물량 전년동기대비 +14.8%; 전분기대비 +4.6%) — 즉 가격·물량 동시 기여.  
  4. AI·서버 수요 등 고성능 반도체 수요 확대 및 글로벌 수요 회복, 재고 축소(-28.8% 수준의 재고증감율 등)가 수출 호조를 뒷받침.  
  5. 다만 국내 반도체 생산의 증가세는 다소 둔화된 상태임(보고서상 언급).

출처: 한국은행, 「2024년 2/4분기 주력산업 모니터링 보고서(Ⅰ. 반도체)」 (문서 1, 2024년 2/4분기).","2024년 2/4분기 반도체 수출증가율은 전년동기대비 +53.5%로 높은 증가세를 보였습니다. 보고서는 수출 증가가 메모리반도체를 중심으로 이루어졌고, 3/4분기에도 AI 서버 투자 확대에 따른 고부가가치 메모리반도체의 성장세가 이어지면서 범용 반도체 수요도 개선되어 양호한 성장 흐름을 보일 것으로 전망한다고 설명합니다. 다만 빅테크 규제와 대중 무역제재 등 정책 불확실성과 AI 인프라 투자 여력 축소 우려는 향후 리스크로 제시하고 있습니다.",0.5,0.9999999999,0.3333333333333333,0.610560695756924,0.45046878511720323
2024년 2/4분기 기준 반도체 수출은 전년동기대비 어떻게 변했나요?,"['[Document 1]\nMetadata: {\'year\': 2024, \'subject\': \'\', \'has_images\': False, \'format\': \'PDF 1.4\', \'keywords\': \'\', \'creationDate\': ""D:20240809153829+09\'00\'"", \'modDate\': ""D:20240809153829+09\'00\'"", \'creator\': \'Hwp 2018 10.0.0.10640\', \'file_path\': \'/workspaces/codespaces-jupyter/llmops_class/data/bok_major_industry_reports/2024_2사분기_주력산업_모니터링_보고서.pdf\', \'producer\': \'Hancom PDF 1.3.0.538\', \'trapped\': \'\', \'page\': 5, \'title\': \'\', \'author\': \'0510190\', \'source\': \'2024_2사분기_주력산업_모니터링_보고서.pdf\', \'quarter\': 2, \'page_count\': 38}\nContent: 2024년 2/4분기 주력산업 모니터링 보고서(Ⅰ. 반도체)\n\n#### <산업별 모니터링 결과><산업별 모니터링 결과>\n\n\n\n\n\n**1. 2024년 2/4분기 중 반도체 수출은 전년동기대비 53.5% 증가하면서 증가세(전분기 +50.7%)가**\n\n\n**확대되었다. 메모리반도체(+93.6%)가 수출 증가를 주도한 가운데,** **시스템반도체(+13.1%)**\n\n\n**의 증가도 가세하였다.**\n\n\n반도체 수출 호조 지속 반도체 생산은 증가세 축소\n\n\n[그림 1.1] 반도체 수출 [그림 1.2] 반도체 생산\n\n\n자료: 한국무역통계진흥원 자료: 한국은행, 통계청\n\n\n1) AI 반도체 시장 전망(십억불, Gartner) : (2022) 42.2 →(2023) 53.7 →(2024 [e] ) 84.3 →(2025 [e] ) 114.0 →(2026 [e] ) 144.2 →(2027 [e] ) 173.9\n2) 2024.2/4분기 중 반도체 수출물가지수(계약가격기준)는 전분기대비 9.9% 상승(전년동기대비 +42.4%)하였다.\n3) 2024.2/4분기 중 반도체 수출물량은 전분기대비 4.6% 증가(전년동기대비 +14.8%)하였다.(한국무역통계진흥원)\n4) 경기지역 전자･영상･음향･통신 부문 재고 증감율 : (2월) -13.4% →(3월) -16.7% →(4월 [p] ) -28.8% →(5월 [p] ) -28.8%\n\n\n                       - 1\n\n[Document 2]\nMetadata: {\'format\': \'PDF 1.4\', \'producer\': \'Hancom PDF 1.3.0.538\', \'author\': \'0510190\', \'file_path\': \'/workspaces/codespaces-jupyter/llmops_class/data/bok_major_industry_reports/2024_2사분기_주력산업_모니터링_보고서.pdf\', \'trapped\': \'\', \'creationDate\': ""D:20240809153829+09\'00\'"", \'subject\': \'\', \'keywords\': \'\', \'source\': \'2024_2사분기_주력산업_모니터링_보고서.pdf\', \'creator\': \'Hwp 2018 10.0.0.10640\', \'modDate\': ""D:20240809153829+09\'00\'"", \'page_count\': 38, \'has_images\': False, \'page\': 5, \'year\': 2024, \'title\': \'\', \'quarter\': 2}\nContent: 2024년 2/4분기 주력산업 모니터링 보고서(Ⅰ. 반도체)\n\n#### <산업별 모니터링 결과><산업별 모니터링 결과>\n\n\n\n\n\n**1. 2024년 2/4분기 중 반도체 수출은 전년동기대비 53.5% 증가하면서 증가세(전분기 +50.7%)가**\n\n\n**확대되었다. 메모리반도체(+93.6%)가 수출 증가를 주도한 가운데,** **시스템반도체(+13.1%)**\n\n\n**의 증가도 가세하였다.**\n\n\n반도체 수출 호조 지속 반도체 생산은 증가세 축소\n\n\n[그림 1.1] 반도체 수출 [그림 1.2] 반도체 생산\n\n\n자료: 한국무역통계진흥원 자료: 한국은행, 통계청\n\n\n1) AI 반도체 시장 전망(십억불, Gartner) : (2022) 42.2 →(2023) 53.7 →(2024 [e] ) 84.3 →(2025 [e] ) 114.0 →(2026 [e] ) 144.2 →(2027 [e] ) 173.9\n2) 2024.2/4분기 중 반도체 수출물가지수(계약가격기준)는 전분기대비 9.9% 상승(전년동기대비 +42.4%)하였다.\n3) 2024.2/4분기 중 반도체 수출물량은 전분기대비 4.6% 증가(전년동기대비 +14.8%)하였다.(한국무역통계진흥원)\n4) 경기지역 전자･영상･음향･통신 부문 재고 증감율 : (2월) -13.4% →(3월) -16.7% →(4월 [p] ) -28.8% →(5월 [p] ) -28.8%\n\n\n                       - 1\n\n[Document 3]\nMetadata: {\'keywords\': \'\', \'author\': \'0510190\', \'has_images\': False, \'quarter\': 2, \'format\': \'PDF 1.4\', \'source\': \'2024_2사분기_주력산업_모니터링_보고서.pdf\', \'trapped\': \'\', \'page\': 5, \'title\': \'\', \'subject\': \'\', \'page_count\': 38, \'year\': 2024, \'file_path\': \'/workspaces/codespaces-jupyter/llmops_class/data/bok_major_industry_reports/2024_2사분기_주력산업_모니터링_보고서.pdf\', \'producer\': \'Hancom PDF 1.3.0.538\', \'creationDate\': ""D:20240809153829+09\'00\'"", \'modDate\': ""D:20240809153829+09\'00\'"", \'creator\': \'Hwp 2018 10.0.0.10640\'}\nContent: 2024년 2/4분기 주력산업 모니터링 보고서(Ⅰ. 반도체)\n\n#### <산업별 모니터링 결과><산업별 모니터링 결과>\n\n\n\n\n\n**1. 2024년 2/4분기 중 반도체 수출은 전년동기대비 53.5% 증가하면서 증가세(전분기 +50.7%)가**\n\n\n**확대되었다. 메모리반도체(+93.6%)가 수출 증가를 주도한 가운데,** **시스템반도체(+13.1%)**\n\n\n**의 증가도 가세하였다.**\n\n\n반도체 수출 호조 지속 반도체 생산은 증가세 축소\n\n\n[그림 1.1] 반도체 수출 [그림 1.2] 반도체 생산\n\n\n자료: 한국무역통계진흥원 자료: 한국은행, 통계청\n\n\n1) AI 반도체 시장 전망(십억불, Gartner) : (2022) 42.2 →(2023) 53.7 →(2024 [e] ) 84.3 →(2025 [e] ) 114.0 →(2026 [e] ) 144.2 →(2027 [e] ) 173.9\n2) 2024.2/4분기 중 반도체 수출물가지수(계약가격기준)는 전분기대비 9.9% 상승(전년동기대비 +42.4%)하였다.\n3) 2024.2/4분기 중 반도체 수출물량은 전분기대비 4.6% 증가(전년동기대비 +14.8%)하였다.(한국무역통계진흥원)\n4) 경기지역 전자･영상･음향･통신 부문 재고 증감율 : (2월) -13.4% →(3월) -16.7% →(4월 [p] ) -28.8% →(5월 [p] ) -28.8%\n\n\n                       - 1\n\n[Document 4]\nMetadata: {\'producer\': \'Hancom PDF 1.3.0.538\', \'title\': \'\', \'has_images\': False, \'page_count\': 38, \'modDate\': ""D:20240809153829+09\'00\'"", \'author\': \'0510190\', \'trapped\': \'\', \'page\': 30, \'keywords\': \'\', \'subject\': \'\', \'source\': \'2024_2사분기_주력산업_모니터링_보고서.pdf\', \'creator\': \'Hwp 2018 10.0.0.10640\', \'year\': 2024, \'creationDate\': ""D:20240809153829+09\'00\'"", \'file_path\': \'/workspaces/codespaces-jupyter/llmops_class/data/bok_major_industry_reports/2024_2사분기_주력산업_모니터링_보고서.pdf\', \'quarter\': 2, \'format\': \'PDF 1.4\'}\nContent: 2024년 2/4분기 주력산업 모니터링 보고서(Ⅶ. 휴대폰)\n\n\n\n\n###### 최근 동향\n\n**1. 2024.2/4분기 중 휴대폰 및 부품 수출은 완제품이 10.5% 감소한 반면 부품은**\n\n\n**23.9% 늘어나 전년동기대비 12.0% 증가하였다.**\n\n\n휴대폰 및 부품 수출은 전년동기대비 12.0% 증가 완제품 수출은 감소하였으나 부품 수출은 증가\n\n\n[그림 7.1] 휴대폰 및 부품 수출 [표 7.1] 2024.2/4분기 휴대폰 및 부품 수출\n\n\n(단위: 억달러, 전년동기대비, %)\n\n|Col1|완제품|Col3|부품|Col5|\n|---|---|---|---|---|\n||**금액**|**증가율**|**금액**|**증가율**|\n|미 국<br>0.10<br>(-96.6)<br>0.42<br>(39.7)<br>E  U1)<br>4.97<br>(-4.0)<br>0.71<br>(16.4)<br>중 국2)<br>0.33<br>(5.2)<br>11.57<br>(20.0)<br>베트남<br>0.05<br>(21.1)<br>5.51<br>(15.8)<br>인 도<br>0.01<br>(-38.8)<br>0.65<br>(5.7)<br>전 체<br>7.96<br>(-10.5)<br>20.81<br>(23.9)|미 국<br>0.10<br>(-96.6)<br>0.42<br>(39.7)<br>E  U1)<br>4.97<br>(-4.0)<br>0.71<br>(16.4)<br>중 국2)<br>0.33<br>(5.2)<br>11.57<br>(20.0)<br>베트남<br>0.05<br>(21.1)<br>5.51<br>(15.8)<br>인 도<br>0.01<br>(-38.8)<br>0.65<br>(5.7)<br>전 체<br>7.96<br>(-10.5)<br>20.81<br>(23.9)|미 국<br>0.10<br>(-96.6)<br>0.42<br>(39.7)<br>E  U1)<br>4.97<br>(-4.0)<br>0.71<br>(16.4)<br>중 국2)<br>0.33<br>(5.2)<br>11.57<br>(20.0)<br>베트남<br>0.05<br>(21.1)<br>5.51<br>(15.8)<br>인 도<br>0.01<br>(-38.8)<br>0.65<br>(5.7)<br>전 체<br>7.96<br>(-10.5)<br>20.81<br>(23.9)|미 국<br>0.10<br>(-96.6)<br>0.42<br>(39.7)<br>E  U1)<br>4.97<br>(-4.0)<br>0.71<br>(16.4)<br>중 국2)<br>0.33<br>(5.2)<br>11.57<br>(20.0)<br>베트남<br>0.05<br>(21.1)<br>5.51<br>(15.8)<br>인 도<br>0.01<br>(-38.8)<br>0.65<br>(5.7)<br>전 체<br>7.96<br>(-10.5)<br>20.81<br>(23.9)|미 국<br>0.10<br>(-96.6)<br>0.42<br>(39.7)<br>E  U1)<br>4.97<br>(-4.0)<br>0.71<br>(16.4)<br>중 국2)<br>0.33<br>(5.2)<br>11.57<br>(20.0)<br>베트남<br>0.05<br>(21.1)<br>5.51<br>(15.8)<br>인 도<br>0.01<br>(-38.8)<br>0.65<br>(5.7)<br>전 체<br>7.96<br>(-10.5)<br>20.81<br>(23.9)|\n\n\n\n자료: 한국무역통계진흥원 주: 1) 영국 포함,  2) 홍콩, 마카오 포함\n자료: 한국무역통계진흥원\n\n\n88) 최근 삼성전자 등 글로벌 기업은 글로벌 통상 여건 변화에 대응하여 세계 각지에 분포한 생산기지의 생산물량을 유\n\n']","2024년 2/4분기(2024년 2분기) 반도체 수출은 전년동기대비 53.5% 증가했습니다. 메모리반도체가 +93.6%로 증가를 주도했고, 시스템반도체도 +13.1% 올랐습니다. (자료: 한국은행, 2024년 2/4분기 주력산업 모니터링 보고서 — 문서 1)  

참고: 같은 보고서에 따르면 수출물가지수(계약가격기준)는 전년동기대비 +42.4%, 수출물량은 +14.8%였습니다.","2024년 2/4분기 기준 반도체 수출은 전년동기대비 크게 증가하였습니다. 구체적으로는 53.5% 증가했고, 이는 메모리반도체 가격 상승세 지속과 고부가가치 메모리반도체의 견조한 수요, 그리고 IT 전방산업 수요 회복 등에 힘입은 결과입니다.",0.8333333333333334,0.9999999999,0.5,0.767551703460078,0.3498063855034711
